0,1
this whole he controversy so clearly comes off as a fake set up schemery for whatever reasons especially with all the major media outlets covering and helping publicize this even more than it already is and those of us who know know who truly controls and owns the media,2
youtube has became a major platform that the presstitutes and jews see fit for use of their propaganda with the increase of the internet and the web tv is becoming less of a thing and they know that and when they cannot brainwash the masses with tv anymore they will use the internet youtube and that is what they are doing,2
i would suppose that they are doing this to crackdown and censor the freedom of youtube the video clearly appears staged bunch of actors smiling worst of all the body clearly appears fake and stiff as a dummy what is scarier is that seemingly of the people are gobbling this story up with zero question i have to remember though that the majority of people still trust their goverment media and live inside the legendary symbolic reality called the matrix they are not ready to be unplugged,3
kid is a fucking loser go hang yourself bitch boy,2
why he why,3
put he didnt know how to feel,3
you news reporters are soo ignorant,2
he was my favourite youtuber but then he screwed it up now what job is he going to have,3
eh you guys realize that he is already set for the rest of his life and with a very expensive lifestyle lol,0
he went to far on the video,0
first of all just because he was making a lot of money that doesnt make him a celebrity or famous i didnt even know who he was before this and neither did other people that i talked to only one out of eight people knew who he was when you are a celeb at least out of people know who you are by name he didnt even come close,2
also not many sane people would want to hire a person with the morals of satan like he mocking dead people just for views is morally repulsive in anyone book well except for hes,2
samantha copeland he will probably be your investment banker then make a youtube video of stealing yours and other peoples money to a country with no extradition,0
he didnt do anything all react like its him who hanged that guy lol,3
i actually feel bad for he,3
youre dumb,2
whats all the fuss about showing a dead body,0
stop talking bout it if u dont like it dont talk about it geez u guys are so dramatic,2
give him a second chance dang he is a good dude so u try and get mil subs,0
heg why,3
would not expect anything more from a child grow up,0
shut the fuck up were not perfect,2
he is a disgrace to youtube,2
followers its friggin subscribers,2
omg he is crazy for showing a dead body he i do even know what to say,0
fuck this guy fucking idiot man cant believe people even give him the time of day why would anyone want to look up to or idolize this clown,2
i love heg,1
i know this was weeks ago but seriously im trying to get away from it but dammit its hard to get away from it its getting old about people still talking about it especially in school god the kids are soo annoying in school talking about it i sometimes just wanna get up a slap them so bad cause its getting super annoying hearing about it,2
he know,1
haha apparent,2
im the heg,1
against he,1
i am such a fan,1
one mistake should not define who a person is,2
did she just say followers instead of subscribers laugh my ass off,0
soul idc i just like to reply to anything,1
dasha pacheco what the fuck i wasnt talking to you,2
soul as a matter of fact you yes yes i am,1
are you retarded or,0
basically the same thing,0
seriously im getting tired of abc news,2
he definitely deserves what hes getting but he does deserve a second chance we cant stay mad at him forver he is only human and we should forgive like jesus christ forgave us for all the sins we did yes it was wrong but he isnt perfect and yes he really fucked up but its not like he murdered anyone he is young and dumb and his whole life should not be ruined because of one bad choice,1
well whether you like it or not hes getting a second chance because hes going to start vlog again on wednesday and youtube wont stop him,2
no he does not and dont mention christ in this situation its kind of different,3
mill followers or subs,0
well um youtube can take down his videos,0
mil followers on youtube,1
heg,1
i hate lp because he is a bad guy in the story,2
i do believe he should have stopped recording but everyone makes mistakes i know ive made some really mistakes and ive gotten more than a nd chance he deserves one too although he is famous and a lot of ppl look up to him including me he is human like all of us and we all make mistakes so i believe he deserves a nd chance but thats just my opinion so plz dont start hating on me cuz its not gonna change the way i feel about this situation i look up to he and will always forgive him no matter what cuz im a real fan i love you he and hope you come back soon,3
no he does not deserve a second chance he crossed the line,2
stupid idiot he,2
now its on the news,0
you are the worst,2
fucking fuck its not his fucking falt u peace of shit people hors ho think he is a fucking monster no he is a fucking human being give him a fucking brake i mean shit fuck,2
didnt watch the original video but saw it on my feed,0
i thought that bitch was doing it and faking for likes,0
boy was i wrong,0
this hole issue is stupid ppl die everyday they went to a place that is known for ppl going to die y would not they expect to actually see something y isnt the place they went to under scrutiny or the government ther that is openly nd knowingly allowing ppl to go into this forest to die wake the f up death is apart of life it happens u should not shame ban or hate sum cuz they saw recorded a dead person ther dead they dont care,2
never mind,0
did they take the video down,0
his channel is done i feel sorry for him,3
yeah i know he apologized but still not a good idea to make a video about it i wouldnt have even commented on it i would just report it to the authorties it could be apart of a murder case or something personally i think he should get banned for it its pretty offensive because ive witnessed death before from someone close and if i found out he just took a picture of that person and voiced it on you tube id be pissed id file charges at the very least he might get banned for it because thats pretty serious i hope he learned his lesson though,3
he said sorry he need a nd change,0
nevermind,0
de wae,2
fuckin pathetic,0
watch rudy a young youtuber who made a song called everything is all right its a nice song that will make you happy for sure,1
i did not cry,3
didnt cry,1
so im tuff right,1
not crying,3
here is something sad,3
i never have enough for anything at stores as a kid and im almost an adult and still dont have enough for skool supplies,3
im realy sad from that,3
what this is beautiful,1
i did not cry,3
i didnt cry lol,3
if that didnt get rights to this song happy birthday this is legal i think im the only one thinking that,0
i cry,3
plot twist man in question is and never,0
ngl i didnt cry it put a smile on my face,1
i did not cry,3
im not crying you are,2
im not crying im just thankful for that man,1
me too,3
i cant stop,3
i cry so much,3
what i didnt cry,3
we are so privileged,1
this kid is a brat,2
i didnt cry,1
i dont cry,2
take the l,0
i was already crying at i just have a pure white heart,3
i didnt cry bois,1
i think i almost cried,3
i didnt cry at all or anything,1
i cried at the end i think the grandpa might be the guy in the queue from the first time i dont know maybe,3
i cant cry,3
but the video is amazing full of morals,1
i didnt even cry,3
wait was it the grandpa that gave the boy the cake then the girl got the cake for the grandpa that gave the little boy the cake,1
lol this video is so funny xd lol wow,0
i didnt cry,3
i did cry okey,3
so that means its nt,3
i really cry because of the story i am touched,3
i am crying,3
wow i thought i was not going to cry it feels like cutting onion,3
what goes around come back around lol hope i got it right,0
me pfft this wont make me cry,3
me again fills bucket with my tears,3
who got emotional after watching this hit a like,3
great now my pillow is soaked,2
here is a beautiful lyric song for them,1
undo lyrics,1
creator sanna nielsen,1
silent i cant wait here silent,0
working up a storm inside my head,3
nothing i just stood for nothing,2
so i fell for everything you said,1
hear the rumble,2
hear my voice,0
gotta make a change and make some noise,1
undo my sad,3
undo what hurts so bad,3
undo my pain,3
i know that i am over you,1
undo my sad love,3
gonna get out through the rain,1
trouble baby im in trouble,1
at last i know what i should do,1
every time i look into your eyes,1
save me oh im gonna save me,1
far away from all the crazy lies,1
my sad love,3
ok i havent finished the video but that guy wanted the cake and the girl didnt even say thank you,2
new thing grandma getting this guys number,1
that was not sad but it had a meaning always give kindness,1
that wasnt sad at all,1
aw true act of kindness is so awesome haha,1
i did not cry it was realy not sad,3
who tf disliked,2
whos so emotional fucked up they did not cry,3
yay i did not cry haha im actually practicing how to not cry easily haha,1
if you think that is sad you will cry with this,3
my parents taught me not to cry at the slightest of anything this did not make me cry nothing will unfortunately lol,3
can someone explain why this is sad,3
show of,1
my face is drowning in tears rn,3
why are all these videos asian,3
hit a like if u ever cried,3
that shit was whack,0
im supposed to cry not to cringe,3
sad music plays slowly in background,3
jal,1
i am proud of being asian,1
jalo mom after watching video hell yes,1
kindness is so simple,1
i just came here to cry for,3
so sad,3
omg i did cry,3
like me,1
seconds in its already making me sad,3
right how many homeless destitute asians do u really see out here get it a white thing,3
i wish the world was full of men in the queue,1
it didnt made me cry but it was cute and sad,3
it did not make me cry,3
who went straight to the comments,0
i totally cried,3
i didnt understand,3
this made my cry,3
like if you did too,2
didnt cry,3
i didnt cry o,1
did anyone notice that the man that buys the cake for the boy is the grandpa,0
well thats what they were trying to show on the note,1
i did not cry,3
that made me laugh,1
omg i cried but i tried so hard not to first,3
im drowning in tears and its not the first time i watch this video,3
it didnt,3
this is so good,1
i even cry,3
no but kind of make me cry but it is happy,3
i mean good story but not enough to make me cry,3
who did not cry but was very happy about it,1
i couldnt cry,3
did you,0
that guy like and the family are like homeless peole,0
but to be honest this was an sad story if i walked by that little girl i would buy everything for her for a birthday a cake candles balloons and more i have the money,3
omg did u guys realize that old man it was the man who bought the little boy the cake so when the little boy growed up he bought the poor little girl a cake as well watch again if u did not understand,0
the little girl is so stinking cute,1
that was real nice but not something i would cry about,3
that wasnt even sad wtf,3
i am really crying,3
my brother died when i was seven,3
i dont cry,2
i didnt cry but my brother cry so much,3
i wish i could be this pure hearted and nice but this world is just too toxic to be myself,3
im not crying,2
i want to cry but my diagnosis make me fell no emotions at all basicly psychopath,3
this was heart melting and beautiful someone kind and compassionate helped someone else in need so that sweet little girl her brother and grama could bless grandpa with a nice birthday cake and he wouldnt feel forgotten on his birthday and the young man who did this kind and loving gesture for them was paying it forward as he was asked to by the kind man who blessed him on his birthday when he was a little boy recently my husband and i have been richly blessed at christmas time by a couple of very kind loving and generous strangers as well as surprised and blessed by friends of ours and i want to say a huge thank you to all of you lovely children of god who have done this for us both we love you very much and you truly make a difference in our lives and otherwise gratefully look forward with joy in paying it forward also and it so reminds me of what the lord jesus christ did for every single one of us when he paid the price on the cross for us and saved us from all of our sins when we were hopeless sinners in need of a savior he took our place and cancelled our debt so we can be reunited with him our creator if we only accept his precious and beyond awesome gift of eternal life safe with him thank you precious jesus and heavenly father i love you forever and am so grateful and amazed at your love and grace i love you all too my brothers and sisters you are all previous every one merry christmas and blessed new year in,3
i didnt cry,1
oh its very sad moments,3
funny funny,0
i didnt cry its hard to not cry about ripple,3
they say you gonna cry but its so boring you cannot cry from that,0
i cried,3
i didnt cry,3
im only through the vid and i already know that the first man in the queue is the grandpa,1
i still didnt cry maybe im young enough to understand it,3
pero no es triste,1
so cute,1
this was so cute,1
i just cried a lot,3
youre skin isnt paper dont cut it,2
youre body isnt a book dont judge it,2
youre life isnt a film dont end it,2
hope this gave you some inspiration always remember you are perfect just the way you are,1
youre face isnt a mask dont hide it,2
i was trying to cry cause my cat bite my hand but i couldnt cry after,3
i didnt have to cry,3
i didnt cry but it was sad and kind,3
how was that sad it was so sweet,3
why are they acting so dramatic over a fucking cake,2
so sweet,1
i literally came here just to cry i want to cry even more i dont know what im going to do huhu i hate my self,3
i didnt cry lol,3
its so cute i cry,3
i love how unnecessarily positive it is pushing the world to be as if russia and iraq dont exist,2
i must cry i was so happy,3
i did not cry like if u did i dont have a grandmother lost heri was sad when i heard the news the she died i never got a single chance to see heri was sad and mad really not a story,3
the video is not cry,3
im very sensitive and i was so emotional i cried a lot im crying wile i typed this if your the same like,3
i remember the last time i saw my mother she had cancer i miss her so much at least she is at a better place,3
this is hilarious this is the most cheesy pathetic attempt at emotion ive ever seen,0
lol i didnt cry but it was kinda sad,3
rambunctious recruit agreed,1
she hit the cart,0
it is so sad it made me crying so much,3
im not even crying,2
i actually cry,3
i didnt cry lol but it was still sad,3
i mean video,0
i didnt even cry but nice video,1
it make me cry,3
thats so heart warming and caring to see,1
who came here just to cry more,3
i only had water in my eyes,3
later,0
stop cutting onions,2
on god i didnt cry,3
i almost cried,3
i dont cry but i was shocked,3
i resisted but i wanted to cry,3
omg this is so sad and now i remember when my sis died in cancer and my mom suicided,3
like if u love ur mom and sis,1
really someone cry while watching this shit,3
i came here to stop my anger and be sad,2
so i was watching this at school and everyone saw me crying,3
im very emotional but it didnt make me cry,3
my emotions work stranger only music trigger my emotions,3
i cant cry for myself so when im sad ive gotta watch sad videos,3
you are a fool to name this video guaranteed to make you cry crying is sadness this is heart warming,3
i am youssef from morocco a student i loved marriage a professor older than me she is years old i am years old i love her for four years and do not like any girl without her i always communicate with her on the communication sites and see her directly although four years have passed and i love her i have not been able to tell her that i love her and wanted her to marry because i did not have a job currently and she has a job and a monthly income that made me not be able to tell her about me i love her and wanted her to marry she is very beautiful i loved to follow her on a daily basis and i see her pictures and also religious and respectful so her beauty is wonderful and i always see her in my mind is the beautiful princess in this whole world but i fear that i did not tell her that i want her to marry and marry someone else this matter will make me stay sad throughout my life because i always find her sweet and a wonderful aura to me and i wouldnt be able to give love to any other girl without her please if you have any advice share it with me or contact me on the contact at this number with all my respects to you thank you,3
and this is so sad its like my mom past away and i got my last kiss and huge i am crying so much,3
this story is kind of like what happened in real life for me but take away the part when people pay for you i wanted something but my parents said they cant afford and off money cause there broke back in there days they couldnt buy food they had to hunt,3
this is so sad its like my birthday but nobody come,3
thats my life,3
was not sad,3
am i heartless for not crying,3
because i saw dis before,0
laugh my ass off why should i cry because of a cake,3
this only made me happy,1
sure are you sure about that im a heartless bastard,2
i once bought some bread and dog food for a homeless man that spends every day and night trying to help himself and his dog he is unable to get a job because he has some type of mental illnesses that prevents him from working i think he has memory loss or some type of short attention span and hes too poor to get treatment,3
am i soulless i didnt cry at all and just laugh,1
so beautiful i always help out,1
almost but its really touching never forget this video,3
that was so sad and cool in the same time,3
this is saf,3
the end was cute and i also cried,3
sad i meant,3
powerful aura that can make people cry but not this person,3
bro not funny didnt laugh,3
that wasnt sad it was just interesting,0
i loved that video it was so sad i almost cried but i didnt that was nice of that man to give that little boy a birthday cake but like if you cry,3
i did not cry,3
what a misleading title,3
this isnt sad this is so happy happy tears,3
it did make me cry,3
all this for a cake it was very touching though,3
i cry ed times,3
i get the video is good and all but honestly when doing an act of kindness you should not expect anything in return even if they offer to give you something in return you should not accept it as to me is seen as an act of payment for your deed doing good deeds or giving up things just to get nothing is the sure way that people should live,1
i wasnt sad it was actually happy,1
i didnt cry,1
this was pretty funny,1
im way to emotional im just stressed and im weird so i watch sad vids to cry,3
so sad and happy,3
i didnt got a chance to cry but i liked it anyways,3
try not to laugh,0
i think that it is more of a happy storie than a sad one,3
u copied this video u do not deserve anything for someone elses work and you still ask for subs and likes you are definitely not worthy,2
this is absolutely not sad im laughing,1
the last one really got to,3
my parents are wondering y am crying,3
bruh there is invisible ninjas in my room cutting onions,3
i didnt cry that was wired,0
is it just me or was it just not sad,3
do you said on the video you would cry after i did not cry you lied,3
i actually almost cried like i felt my eyes heating up not shredding tears,3
omg i cant stop crying fuck life can be sad,3
so sad,3
thx to god we have nice people,1
i didnt cry i dont know why xd like if you cry,3
i didnt cry it wasnt sad,1
oh man i almost cried,3
i didnt cry why am i so like brave,3
martin bignell,1
haha,1
i told myself i wouldnt cry but that was a sniffle lie,3
wait i didnt cry either so does that make me brave,0
am i the percent then,3
am sorry my eyes are in tears always do something nice if you hurt someone there heart shatters if plate shatters and you say sorry it wont go back,3
i didnt cry but it was sad,3
that is super sad and emotional but i didnt cry,3
all the dislikes are tears falling on the dislike button,3
i felt bad for grandma,3
laugh my ass off yes,1
snap cool tony,1
i didnt cry,3
i think i am broken i did not cry what is wrong with meh,3
wow how did i not cry,3
aku who put onion in here,3
in going to sad,3
im not even crying im balling,1
i think in not gonna cry hehe,0
what is so sad i dont get it,3
well its the same time again im sad and i look sad videos nice thats what i need,3
im heart broken,3
lol i didnt cry i was just happy that the man did the act,1
that man is so kind im crying,3
i,1
it got me guys,0
thats really sweet,1
yall this video ended and like i got goosebumps and like wow,0
thank you for having this video out in the public because my week has just been crap and i have needed to cry for so long but couldnt push the tears out so thank you for giving me the extra shove i appreciate it,3
fam that ending when their grandpa was the man in the queue legit shocked me ngl like i had my mouth open laugh my ass off,0
i hate chinese ladies now im crying,3
even though it didnt make me cry i still liked it,3
l did not cry,3
this was so cute i was about to cry,3
is it just me or does anybody else think that plot twist was perfect,0
boy girl anyone could see it coming,0
i dont cry but still sad,3
rambunctious recruit oh nice to know your opinion may i ask why,1
no it was fucking ass,2
who cried,3
actually me,0
i just laughed at the shitty acting,1
mya daou i think im heartless i didnt have one tear im disappointed in myself,3
this is so caring and amazing i didnt cry but i know for a fact that i love this anyway,1
like if you cry too,3
imma cold bitch crying rn,3
kill them with kindness,1
this actually happened to me before but with a zebra cake instead me and my sister went to a tiny store super close to our house and we didnt have enough money for a zebra cake we put it on the counter for someone else to buy but went we exited the store the man ran up to us and said that he paid for it for us i was so thankful i gave him a hug then left everyone can show a spark of kindness by just handing out a gift every kindness has its own world and anyone can join it if they really try,3
so sad,3
i cry,3
i guess im dead on the inside am i like chandler from friends,0
people nowadays fever do that,0
not sad didnt cry,3
who came to cry cause you just wonder whats life for and thats me right now and its so sad i just i just dont know why i do dis stuff,3
spread kindness,1
why cant i cry any video i watch i cant cry,3
i try and try and try no video can make me cry not even da likes or when i lose friends am i missing the pieces of sadness,3
i no cry,3
who actually didnt cry,3
not sad,1
i cant cry right now because my eyes are cold,3
cristiano jr,1
i didnt i cannot comprehend how people find this sad,3
my mom showed this video to me on facebook once,0
that was so sad,3
me too i love this show,1
i bid not cry,3
i didnt cry but it did make me happy its good to see kind people in humanity,1
why am i not crying i did not cry,3
i dont wanna cry i want something to make me feel better,3
this is video makes me so happy,1
omg this is sooo sad,3
my dog died when i was only on my birthday,3
like if u love ur dog,1
edit my cat died the same day too wtf,3
any sad videos like these always make me cry and i cry h a r d,3
my dog passed away when i was,3
matthew trappe oh i was about to say you gonna turn but ur and im years old,3
im so sorry for you,3
what the heck my dog zeus got kidnapped i miss him i want him back he was my best dog along with my own dog oreo i think that was her name i cant remember because she is not here to join me,3
i dont have a dog and when my did have one it when i was a newborn i never got a chance to get to know her,3
i didnt even cry once wtf,3
this wasnt sad i was on my feelings and i thought watching this video would make me cry buh it didnt buh it still is really great so give it a thumb up favor,3
didnt make me cry,3
it was him,2
asian videos are far off of western videos,0
its heart touching and sad but not enough to make you cry,3
but you sadly realize that when you lose it all,3
i am not crying but i sad for something else,3
you need to lose what you have to know how much it is worth and how much it means,1
i really love it but i didnt cry but it made me feel good and learn somethings,1
i have not cry in years am trying to make myself cry but its hard,3
no this didnt make me cry,3
this thing did,2
this replay made me cry,3
i cried at the end,3
i watched this because i had an eyelash in my eye and i needed some way to get it out,3
im very sorry to say but today my classmates mother died like if u can relate or feel sorry,3
i did not even think about crying,3
anyone else noticed she was only buying buy one get on free stuff and off stuff like if you noticed,0
amazing i cant understand that when we see people doing good things its sooo emotional,3
this made me legit tear up,3
made me cry,3
made me cru,2
i cry,3
and sad,3
just here to get something out of my eye literally,0
it was not sad but is was interesting loved it,1
not sad just heart warming,3
that was cool and nice so not sad,1
but remember,1
you are great,1
sorry but the face at,2
i know youre probably sad,3
often we cry,3
knuckles will brighten your day,2
i love you and see what it spells out,1
in germany we call the dude in the supermarket a,1
was fr ein dies zu,3
i didnt cry wait am i soulless na i cry to much for everything else,3
i love you all so much and stay great and stay positive,1
fucking bitch i didnt even cry,1
