0,1
who is listening january,0
good one loved it,1
hipster music,1
nice and relaxing to read books and rest,0
i do,2
thank,1
hey what is up guys welcome back to my channel hit that like if you have not already,1
joyful music,1
e klia i ka nuu,3
medicine may cause death,0
this really does help lighten the load,2
g two strums down,1
one strum up all strings open quickly,1
people in the ad,2
to play the first song,3
d two strums down,1
repeat over and over,1
thank me later xd,1
very goodlife music,1
c d d u u d u,1
this plays at the treblinka death camps gift shop all day long,0
so beautiful,1
it sounded like a background music for diy youtube videos,0
aloha always sweet sweet beautiful sweet music from the beautiful hawaii sweet lovely music always sweet aloha good morning everyone always god bless you amen,1
so thats where the sims buy their music od,0
listen to this every morning to start happy and relaxed love it,1
aku suka,3
beautiful music happy,1
i can listen to this music while doing chores around the house lol,1
i played this while playing getting over it with bennett foody,3
this is spent coding c,2
this music give me an erection,1
this is my favorite music to murder to,1
sounds like the first second introduction of every youtube cooking video,0
how can be,3
this is great,1
holy shit this is hilariously accurate lol,0
you can torture me with this,1
serving as background music for every cute cat and dog video ever,1
im here after jo koy,1
would love to have the sheet music for this beautiful,1
is this available for download itunes,0
si hope good soooo i start my day with lemon water its soooo good and hydrating,1
i love that one,1
i will play this in my new ford mustang while ripping around the coastline,1
makes me think of one of those spiderman and elsa videos,0
mmm especially vegan ones that start every sentence with so,1
weird flex but ok micheal jackson,1
could you please list the name and artist of the songs thank you very well done music video perfect for relaxing,1
good thankyou,1
i just got back from an unforgettable seven day vacation i miss you hawaii and all the great memories you have given me and our family mahalo and god bless this paradise island,1
super saint hawaii has many activities to take advantage of some are free and many are costly the zoo was beautiful and free i enjoyed zip lining in the rain forest and parasailing at kona go to groupon for better pricing if relaxation is what you are looking for many of the beaches like the black sand beach will satisfy with the most jaw dropping sunrises and sunsets beach is beautiful too the tsunami museum in hilo is only adults and kids hawaii volcanoes national park is per vehicle and open there is a beautiful view of the volcanoes and crater from the volcanoes house you dont have to eat at the restaurants but you can get a great view from there and they have a nice lounging area the big island is so amazingly beautiful but it is very hot and humid right now and it can rain at any time just be prepared we were rained out for a couple of days the scenic drives made the travel time short minimal to no traffic food can be very costly so plan ahead shaka restaurant in has the best moko loco and other food items you get a ton of food and the price is good for the quality and amount enjoy your time mahalo,1
e z imma go to hawaii next week and i wonder if its fun over there,0
ill be there one day one day,1
hawaii is amazing went there last summer truly amazing,1
f you want to start day happy verry good,1
good song,1
first song whos whistling soulful effort,1
awesome,1
is so relaxing i love it,1
see white woman on the cover thumbs down,1
and i love banjo too,1
track list whats the name of the first song,0
name of first track please,3
what the music playing who knows,1
my parrot gets so excited when i put this was hopping and swinging and flapping about actually so was i,0
can someone tell the chords please,3
i am european do love hawaiian music but this doesnt sound very traditional to me all not the style that i enjoy for me it must be fully traditional sorry guys no offence just sayin,3
finally got through to the video got the same freaking add times in a row too many adds today its annoying as carrot,2
love it i put it on when i do homework,1
playlist mais un peu beaucoup la fin les chansons sont passes en boucle,1
what is the title of the track at,0
i made a hawaiian dance because this made me dance,1
this is seriously amazing had i been given another life i would have remained happy without any achievement victory appreciation or acceptance i would have started things being happy not to be happy but hey can do that in this life as well happiness is a choice not a destination be happy be sad there is and will always be only one life,1
like it,1
this song makes me smile even though i got robbed,0
este,2
no ka i ka mai ka poe hana hewa e hana nei i ka hana i ke,2
e ka mea pili i kia,2
no ka i n nui i ka national security,2
ke nei au e hai ioe i kau mau no ke i ka legalization of drugs,2
e n o ka w hou o n luna e ke kl,1
ak he aha ka mea e pili ana i ke pono,1
e i kahi hui hou e k i n lau o ka hui ia ka me n o n manawa n a me n mea hawi i n lau a i ka i ko a me n mea e ai e i ko a me n mai,1
o james madison,1
tupac i ka mua ua i ia kona makemake ak barrack obama ma he shinning example o ka mea a ke e hiki ai ke lilo o martin luther king jr a me n mea ae he nui loa e e mahalo i kou lima ma ka lani,2
ka hua i kamehameha,2
dont worry be happy,1
ka hua i,2
n pepa,3
o kahi e hana like i loko o ke unity for the people,1
hello i would like to know if you could please tell me the name of the author of the first song or if it is you do you sell the music for youtube videos,1
what videogame is this from our hotel in turkey played it each morning nice atmosphere,1
this music is an immediate mood lifter,1
i sounds like home made tutorial back ground,3
thank you,1
learn how to make paper boat,2
just sounds like diy music,1
the ukulele to me has the nicest sound out of any instrument its so soothing,1
thank you my soul is happy listening this music my emotional stress feels much lighter,1
i dont know how but ya read my mind,1
me before i commit st degree murder,2
play this while a huge tsunami is happening,1
couldnt sleep all night because the geckos on the ceiling made a lot of music,0
thank god this exists,1
this is like the music for every kickstarter advert ever,1
i have hours left to live what do i watch music,3
hey you you r wonderful no matter what be on a bright side of this world and be happy,1
may god bless all the people in the world,1
i play this to make my bird happy,1
life goes on never forget that things seem bleak and painful and like the end of the world but your standing and breathing and thats a good thing life the life you have nothing will get in your way if you keep looking up to blue skies yeah theres gonna be clouds but thats like life we all want blue skies and go back to the past where things seemed perfect but i can promise you it gets perfect if you keep moving forward one step at a time you can do it i believe in you from the bottom of my heart now go and live life,1
thank you so much god bless you this made me feel so much better,1
loved this,1
i play this when i get stressed out,0
so shit,2
the flow of the music brought me into a different kind of view where the place is filled with endless joy and laughter,1
u made my day,1
i fucking rave to this shit,1
is that copyright free music,0
got a hawaiian themed th birthday party going on i have never seen every single person smiling and dancing around the kitchen like this before,0
i will always keep coming back here no matter how much time goes by its my little secret place of escapism,1
ive been to hawaii and this music just took me back to those beautiful islands of hawaii little paradise so i closed my eyes and imagine i am there again right now the effect is so real and love it happy times,1
this is beautiful luckily i found this amazing video much love xx,1
wishing i was in hawaii,3
im cleaning my room dancing to this wonderful music,1
happy days for you,1
super,1
im studying chemistry and im picturing myself studying in hawaii and on the beach d,1
even my dog slept with this song he just went right to me and he slept it was so cute and i slept right beside him it was so adorable,1
i hate u i love u,3
no one even dose anything so i write write write all day,0
this makes me happy well done,1
my broken heart was so good now haha im from philippines,1
this is exactly what i was looking for,1
finally i found u,1
it helped me work on my project,1
im going to hawaii this june and i am so excited im a travel vlogger so ill be posting everyday from june nd to the th hawaii cant wait to meet you,1
when u cant think of anything to inspire you,3
does anyone happen to know the song at,0
ar,1
aloha from yes i love it here im doing the honolulu left right left love it all i need its a cold colada refreshing love to see you soon,1
i listen to this while watching mexicans sneak drugs across the border,0
thank you for this also i play this when im doing a test or play halo on the xbox,1
hey people tot i think was his name first commented,1
hey i like very much,1
really happy music,1
okay you first person to comment,2
you are really lucky,2
oh my god people,2
holy lord,0
i like the music,1
nothing can make me relaxed but it is very nice music indeed,1
who and why can dislike this i just discovered this great music and i love it so much,1
when your joy upon your damn life is a great great mistake and over her youll do everything to keep up appearances on that shitty music of yours,2
download link please,3
i play this while playing the last of us,1
i read my bible to this,1
is this copyrighted want to use a song in a video,0
love it,1
just eatin chocolate while jamming to this,1
why do i feel like im in build mode,3
the life d,1
i was like gonna look for a song to make me work better now im almost falling sleep thats so good omg,0
very nice,1
what is the music that starts at,0
someone know song named ukulele girl,1
it helps me with my depression thank you so much,1
t gay,2
gracias gracias gracias te amo,1
can i get this music on itunes i love it,1
hi my daughter loves playing ukulele,1
unboxing mystery boxes from dw makes it kinda scary,0
de,2
when everyone afk in your team but you win,1
love it,1
bravo,1
que linda musica me siento en la playa bailando con las palmeras,1
ya me siento mejor,1
listening to this pretending its not stupidly cold and snowy outside no offense to any winter lovers out there,1
a very safe music,1
minute whats the songs name,0
and relax,0
this is great,1
helps me relax,1
i love to do my homework with it or if i craft or if im board as backround music,1
sah i just searched up hawaiian music,1
polynesian culture center comes to mind and the buff guy destroying the coconuts d,1
im selling replay buttons,1
this is my fortnite default music,1
always makes my day,1
when a dog dies in a movie this is what i play,3
just wonderful thank you for uploading,1
on a serious note this really helps with my paranoia at night its loud but happy and very smooth,1
what is the name of the st song i really want to learn it,0
makes me feel so happy,1
love it,1
is my favorite,1
just watched a horror movie this will help me cope,0
depression who never heard of that thing im a happy little creature,1
this is so sad alexa play,3
im so fucking happy ahhh fuck,1
awesome luv it,1
i will play this when ill burn in hell,1
i need this to pretend that everything is going well haha,0
i wrote in the search bar that fucking hawaiian music for startup videos,2
the sims,1
be happy,1
nice music,1
im listening to this while playing hatred,2
can you say the name of the musics at the playlist,1
what a cancer music,3
please kill me now this music is played on every commercial and tv show now feeling suicidal ignore that phone number on the bridge listen to this and jump,2
relaxes my soul while reading,0
good for watching horror films,0
fuck im so happy youtube exists,1
i listened to this song at my parents funeral,3
thank you great mood lifter,1
nice son,1
what song is,0
a little jar of happiness by earle belo from epidemic sound,1
aaron huckle i was about to feel so bad for you omg,3
people do need to realise this was a joke,0
trying to get through my essay report like,0
its so peaceful by the way how do i ad emojis,1
very much like it to listen to while reading or relaxing or cooking or cleaning house or feeding the dog get the point its great,1
this helps a lot when depression hits me,3
what name first music please,1
i was sad,3
it makes me happy,1
hawaii the best place for a tropical vacation at least until the volcano erupts oo,1
too good,1
luv hawaii music,1
very h a p p y,2
i love the happy music,1
i usually dont add comments on youtube but this music is so pleasing that i couldnt resist myself from posting a comment love you keep it up relax music,1
been playing this track daily to my students in class,0
very great music,1
i am grateful to listen to this,1
love this music always makes me feel better,1
nice,1
hawaii,1
what is the name of first music awesome,1
i play this while i play five nights at freddies because im a baby im too scared thx for publishing the music,1
the no skin music,1
this song is iko music,1
i got this one on in the background every single day for about a year now,0
yes happy music prima volta first time in this chanal feeling ok for my lunch time at pm san valentine day love to everybody,1
my reaction singing when ukulele start tu ruru turu tu ruru tu ru,1
so peaceful,1
hello do you know the name of two first songs,1
good musi,0
i like,1
lovely totally improved my day,1
its so joyful for roblox or any thing else,1
i love hawaiian music,1
music is awesome,1
this music makes me smile,1
this is so cool,1
thanks for those happy music give me all day energy,1
omg i could listen to this all the time,1
this song is perfect i put it on whenever im doing homework,1
amazing,1
rnr homes pros,1
crew loves youre music getz them going,1
thank you much,1
helps us get done quickly crew live the music,1
thank you,1
i love it first music,1
so cute music,1
nice happy music,1
this is really relaxing music for studying and hard mathematics as well as helping have a better day after a really crazy day,1
i am glad to have subscribed to this wonderful channel,1
so relaxing into my ears love it,1
love the mix i listen to it whenever im still really comforting,1
it makes me happy d,1
if ur in vacation,2
if im scared i will play this every time,1
very relaxing music thank you this really calmed me down thank you so much,1
trying to feel good by niklas from epidemic sound,1
are their names to these songs i really like the one with mountain and rainbows,1
nice music i love it,1
pls the name from the first song i love this,1
there are comments i shall be the one this music is like the perfect match for my mood right now,1
i cant help but smile and share share share this every dang time,1
send me your num beautiful girl,1
is this available at spotify,0
relaxing,0
thanks,1
i hope spongebob would use this,0
great for my pain,3
awesome,2
same same rhythm really became happy listening to videos and cafe music bossa nova,1
little big planet,1
oh my gosh yes,1
happy,1
just end it all,3
can i use this in my video,0
amazing this music is basically something i listen too if i am sad because it cheers me up i also wake up to this every morning to get me motivated for school this absolutely is amazing for studying as well if i would i would give this billion thumbs up totally subscribing and you all should too thanks relax music for doing this video i give you thousand kisses,1
can i use this music for my video editing,0
nice song really help me to relax after a long day at school keep up the good work,1
i was singing my own lyrics to these,0
subbed,1
love it,1
yay moosic,1
when im sad i listen to this it makes me feel better,1
amen,1
me only difference it doesnt make me feel better,3
me too,3
lord jesus christ can make you really happy just speak to him and give him your heart god bless you,1
i always listen to this when im sad,3
i come here when i want to fucking kill myself,2
may i know the name of the first three songs,0
yo is this some magic like,1
and now its like,2
am happy,1
i was raging,2
thanks,1
dude how,3
thank you so much its the best song i ever heard,1
this is my new work homework music keeps me up and productive,1
wow,3
people accidentally hit the wrong button instead of hitting like,2
helped me a little bit against some filthy clickers and yolo in world of tanks thank you,1
perfect for my and my friends dance routine,1
yes happy music prima volta first time in this chanal feeling ok for my lunch time at pm san valentine day,1
love to everybody,1
this makes me so happy im in love with hawaii their music and their culture in general i want to live there so bad fml,3
turkey,1
thanks to reply to me i had great moment with this music bye,1
thank you for this music it rises up my mood and makes my day happy many blessings to your life,1
wonderful music nice songs thanks good,1
great,2
nice music,1
musique au fet vos pousse pas,1
really good tunes i love ukulele id love to play them so much relaxing greetings from france,1
whats the name of the song where theyre whistling in it,0
la la la la la la la la,1
great but we really need a track list here,3
while working on the case files of executed criminals it sure is great having this in the background to balance out the fucked up shit i read in them with the happy positive music cheers,0
diy background music all over,1
this is amazing and the exact thing im looking for,1
so cool,1
so beautiful om gosh,1
ba je,2
awesome music you made my day even better,1
im sad but now mood is okay now after listening music,1
i said hawaii music not royalty free music,2
perfect for a report,2
love it please may i use it for my video,1
relaxing music,1
the first one tho,0
helps me sleep,0
i enjoy these tunes i find them so relaxing and i like the different melodies and rhythms but i find the tracks very short as im getting into the track i find it ending if whoever created this playlist could make all the tracks longer at least mins for each track i would say,3
people think its for staying awake while im listening this to fall asleep and see good dreams,0
i love your relaxing music,1
these are my favorite tunes i listen to them when i am working to keep me happy i wish i could make music with my ukulele as good as these are,1
i listen to this almost everyday with my friends it makes me feel so happy,1
are they free to use,0
play this for your baby your welcome,1
my son loves this music it gets him sleep all the time,0
thanks for the music whenever i feel sad and lonely i listen to this,1
fantastic one now everyone is happy,1
this is great makes me feel good happy feel happy me,1
feliz ao mi deseo es que un ao lleno de satisfactions personales que dios te y tan bellos videos,1
elsa sanchez,1
is anyone else here because theyre so depressed and desperate for any touch of a good feeling is it just me,3
love this music can this be bought especially for first tunes i am a ukulele tutor and would love to use it as a background to my teaching,1
i was going to play a scary game so i played this over it and it wasnt even scary anymore xd i love this,1
very nice music,1
seems like ive heard some of these on commercials especially the nd tune,0
somebody know the first song plz,3
seconds the music hits my shoulders started moving and i couldnt wait without smiling real medic e,1
a metal head comment passing through,0
name for first three,0
can you please provide a track list to help identify the music,1
awesome thank u so much for the video always makes me feel amazing,1
all music in this video are from epidemic sound,1
track list,1
sweet little one clarence reed,1
all together now karlsson,1
trying to feel good niklas,1
our home our life more than family,1
by the fire georges town,1
fling on a thing,1
fling on a thing,1
a little jar of happiness earle belo,1
feels like yesterday more than family,0
little grin earle belo,1
my smile or the smile karlsson,1
paper bag instrumental version sture zetterberg,1
my smile or the smile karlsson,1
my last name got jax,1
smiling ukuleles karlsson,1
thats fine instrumental version fasional,1
thats all,2
lovely music there,1
i love your music can i use it for my videos,1
please do not use loops they are annoying,2
i use this music a lot,1
i hate winter,2
is it free,0
oh no no no im hawaiian and if you dont want other people to criticize you like im doing right now than take out the whistle,2
came here because im so stressed for my exam tomorrow that i havent studied for and on the brink of breaking down,0
spongebob,0
this is so happy it upset me,3
this is fantastic,1
thank you wow,1
its awesome to hear may i download this,1
when u find true happiness on y t and ur just like,1
came to a video i wanted to watch but it had dramatic and seriously depressing music,3
so i put this on,1
very nice music i like it,1
i use this when im playing outlast,1
yes,1
just trying to write a five page paper the night before its due,0
i like this song,1
love this its something great to hear when you wake up on the right side of the a sunny morning thank to whom created this it truly brings joy,1
i love sea,1
anyone know how i can add this music as background to a powerpoint,0
most relaxing music it refresh my mind happiness is flowing into my life with this music thank you,1
beats,1
stones,1
how can we know the single tracks name,3
this song reminds me of pokemon sun and moon,3
im so deeply mesmerized,1
i have a hawaiian themed celebration of life event coming up for the recent passing of someone who held a dear place in many hearts i think this would be great for the background music its a depressing event but this should be good right your thoughts friends,1
i love it nice ukulele acoustic music,1
should be played at every funeral,3
can i use your music for my travel video with credits thanks d,1
i use this when i draw to give a relaxing mood thanks for the music,1
nice but reminds me of shitty fb videos with awful captions,2
i imagine im in hawaii listening to this while in bulgaria such a shitty weather you guys must be living the dream,1
if i could id reupload this and name it peppy wake up music you play to annoy your college roommates,1
makes me so happy thank for sharing,1
every slime tutorial ever,0
when its saturday,1
can you give me a name of the first song pls i really like this thank you,1
mahalo,1
love listening to this while i am in my craft room,1
can i use this for one of my videos,0
me,1
i was crying and searched up happy music and chose this,3
i listen to this when i do homework very helpful i am obsessed with emojis,1
deleon dynamics acrobatics hi,1
a moment of appreciation to my yo brother i caught napping on a sunny afternoon with this music in the sala,0
me mucho la de ukulele un saludo desde el salvador ca gracias,1
look up little clown thats my reason for being here,1
pentru,1
temas gracias,1
who played roblox before,0
this just made my day into happyness,1
sounds like a kickstarter campaign,0
chords for the first song,1
this is great to listen to while doing homework,1
gdc,1
iam listening this when i play outlast and watching it,1
calming,0
i really like it,1
love this a lot of the relaxing ambient music here on youtube tend to be really really sad its quite hard to find something uplifting this is perfect,3
can i use this in a video,0
i have played ukulele at school only in friday,0
i love this music,1
music is loved,1
wonderful,1
every time i am about to do homework this is my go to video it is so relaxing,0
i just ate a bean that tasted like spoiled milk i then listened to this the spoiled milk was then gone thanks,3
like the title its very cheerful,1
oh yeah ya,1
good vibes bb,1
can you give tutorials for playing ukulele,0
people who have a happy heart have proven to have a well formed x shape in their dna they dont get cancer and have a good life too,1
anyone know the name of the first song,0
truly amazing,1
this made me so happy,1
love it can i use it as background for a video thanks,1
tp is life,1
kid remix,1
thanks for this it made feel better after i got my nail of my toe nail it hurt so bad but it helped me well,1
i listened to this whilst i was taking a shower,0
this sounds like car insurance commercial music,3
nationwide is on your side,1
are you in good hands allstate,2
i have seen in tire commercial,0
i know,1
they really make me feel cheerful and happy i was kinda sad i would love to play the ukulele d,1
are you french,1
the first one is my favourite,1
muy relax gracias,1
first song made my parakeet laugh,1
this is so cheesy i love it,1
i use it for my backround music for my videos,1
great stuff thanks for posting this music,1
ahhh nothing like these classic happy and calm vibes,1
it calm me down in horror movie,0
can you share the chords its really good,1
love it,1
this really helps me sleep,0
relax music thank you very much for creating this video i enjoy listening to this type of music god bless you,1
hey what is the name of the song at,0
nice to wake up thinking of hawai,0
i love it,1
excellent,1
i love it too,1
can you tell me what is the name of the first song in this the one with whistling thank you love it,1
ive been listening to this wonderful music lately thanks for sharing i cant have enough of it,1
when you are cleaning your room and then your sibling put on some random music lol,0
great music,1
alexandra fragoso bom,1
i need this after beef,0
what the name,1
i like hawaiian and irish music it relaxes me and makes me so happy thanks so much for this video,1
what song is at,0
i was stresses out and when i listened to this i felt really relaxing and calm,1
everyone should listen to this,1
