0,1
man i forgot about this laugh my ass off but for real though he should have realized that filming and laughing a dead body would kill his career,0
that dude is a fucking liar what an asshole,2
so what who cares people die everyday,2
a yes but this guys fan base is mostly children and hes just posting a video showing a dead body,0
true but it was still kinda messed up for filming it,3
say that when someone you love dies,3
damn u made a lot of haters xd,1
wait what is she said million followers she said followers is she gone mad due to the he s videos,0
he is irrelevant,0
he says he was trying to raise awareness,0
me but cha didnt,3
but honesty suicide is not a joke and what he did was wrong,3
in my opinion hes a big idiot because he just ruined his career like majorly,2
hold up how did he know that the guys hands were purple without his color glasses,0
i like how abc news calls subscribers on youtube followers,1
dieser witcher,2
was hat er,0
he is shit,2
what a liar,0
this guy was never sorry what a charlatan,2
what a tot the scoundrel,3
me sees body,0
also me imma report this,2
so he tell me why you didnt do this shit,2
when they says followers instead of subscribers like this is face book,3
so i see you have chosen death also,0
nobody cares about this dood anymore,0
followers on youtube uh,0
at the time of this i was a huge fan so as soon as i got that notification i clicked straight away and i was one of the unlucky few some would call me lucky but its honestly a scaring image and i know how others who also saw this feel the whole video was so wrong from the way he was going on about seeing dead bodies and he seemed excited to the fact that he showed the body to an audience made mostly of teenagers and young children but at least he blurred out the face of this poor person more you tubers need to think twice or three times before posting something,0
rip,3
but still it was horrifying to see,3
in my opinion you were lucky to see that video if it had not happened you would never have seen hes true colors,1
youtube should of ban him for life,2
top entertainers of the world filming a dead body and uploading it is entertaining,0
ksi will remove his last brain cells after november th,3
but he didnt in his own hometown,3
why you think he will do beat him in usa,0
is it kinda wrong that i wanna see the video,0
mei bat hie is,3
he also acting like a child,0
new lady he has million followers on youtube,0
youtube am i a joke to you,3
i wish it wasnt deleted i am trying to see a dead body i go online and purposely search for this crap,2
or just go outside and kill someone since theres something wrong with you,2
so go online and search for it,0
i like how everyone is rooting for him with the ksi vs he and they just totally forgot he laughed at a dead body last year,1
yup,0
he laughed after finding the dead body how is that helping,0
y is he trying to box people he should just go back to video peoples dead bodies the pedo hes a fucking cunt and can go rag his mum the bitch,2
he has million followers on youtube,0
wait you can get followers on youtube,0
vp icy ye and i was just saying as well,1
laugh my ass off i was just saying,1
follower subscriber same thing different name why do you kids even care,1
hey guys can u follow me back please,1
miller,1
whos here in watching again this because it makes them feel good,0
me im glad we got rid of he,0
joe aa nope,2
look at pew die pie and hes pretty famous next meme,1
million followers seriously i thought they new what subscribers were on youtube because of the fact of them posting on it,0
he has million followers on youtube,1
this guy is disgusting he is not sorry and never will be because if he was hed never had posted the video and dont get me started on the oh but he apologized and took down the video sh cause he only did it when he was loosing subscribers by the second im not one to hate but if you still like this guy after this video and countless others like this then you are just as horrible as him,2
also can you believe the nerve of this guy to say in one of his tweets i didnt do it for views i have views as if hes telling you how popular he is even when hes supposed to be apologizing honestly guys i dont know how you kept calm and unbothered when you were saying all this if i was there i would have probably told everyone to grab their pitch forks and torches cause we were going on a hunting spree,2
dont be like he or his idiot brother who im sure is just as as his bro if not ill be surprised cause these people are hated by so many people including me be nice respectful kind and thank you for letting me rant i really needed to bye,2
everything about this literally screams he has no feelings,2
jake pal is an idiot a stupid ass hole,2
thats he are you sure you arent the idiot here laugh my ass off,1
i cant even find the damn video has someone a link maybe,2
it was deleted,3
he and jake are both shit,2
guys let me explain a little drop of tea well if anyone sees a dead body in a freaking suicide forest they r prob gonna ditch the forest but lemme tell u my buddy he was all for the views he made sure that he had to record it it only makes sense he is a clout chaser no tea no shade but thats the trust hand ps rip the suicide victim they probably had a hard life sorry my dude rest in peace at least now he is in a coffin probably and not in he s youtube videos,0
yes i liked my own comment,1
anyone,0
aaliyah hola,1
seems like people are making a huge deal about this because of who he is not what he did there are countless similar videos all over the internet so freakin what,2
hutchinson most of hes fans are little kids and the other channels who show dead bodies are mostly aimed at adults,3
i dont understand why people get so mad about showing a dead body shit if you find my body somewhere video away give me the opportunity to photo bomb you as a ghost p,0
chance friend because most of hes are children ages and here he is posting a video with a dead body,3
oh hell no you have million subs,2
imma head out,0
anyone,0
mate tell him ksi is better,0
f you logan,2
good he,1
he nani,0
lets take a moment to acknowledge how she said he has million followers on youtube,1
okay nope still dont give a shit,1
i wish this never happened to him you know how much better his life would be,3
s you right,1
lighting wolf tv oh please cry me a dang river dont make him out like hes the victim in all this hes not,2
i do believe in the old saying what does not kill you makes you stronger our experiences good and bad make us who we are by overcoming difficulties we gain strength and maturity learning lessons is a little like reaching maturity youre not suddenly more happy wealthy or powerful but you understand the world around you better and youre at peace with yourself learning lifes lessons is not about making your life perfect but about seeing life as it was meant to be,1
you know you fucked up when even sansa stark is pissed at you,3
definitely,0
intensifies,2
why are people mad its nothing more than a dead person sure it was someones family but in the end all we are is dust this is not an offensive video people need to grow up,2
youre saying people should come to grips with the fact that this life everything we have experienced and ever will is gonna eventually end and that we should make fun of people for which this external doom has already happened disrespecting their family who has not yet come to terms with the fact that they have to live the rest of their lives with this one person,1
james clark well dude hes fans are mostly little kids and he posted a video with a dead body in it and youre ok with it,0
you are,0
james clark oh you poor sad idiot,3
james clark it is considered disrespectful to film a dead body human,2
and i have to share my birthday with this guy,2
did he take down the vid,0
yeah he took it down immediately because he didnt get the reaction he wanted,2
followers on youtube are subscribers,1
if youre so uptight about someone clear doesnt use youtube using the word follower instead of subscribers you might want to get off of here for a little while,2
year later,3
i found a dead body at area,0
jesus christ xd,0
if the press conference brought you from the kong video to here then welcome,1
is that jake,0
he,1
did no one save this shit wtf i wanna watch it it got taken down before i could watch it when it first came out,2
fuck off from japan,2
he is a nice good looking person and thats why chloe bennet loves him so much,1
heck,0
heck y,1
heck yo,2
heck you,2
heck you l,2
heck you lo,1
heck you log,2
heck you loga,2
heck you he,2
heck you he p,1
heck you he pa,2
heck you he pau,2
heck you he,2
heck you he,2
heck you,2
some reason i always feel like liking sad video is rude,3
followers on youtube,1
come guy a break he didnt record person committing suicide he just uploaded a video of a dead body he found he wasnt thinking at moment about it being insensitive hell if i stubbled on a dead body some where i might bust out my phone to record or snap pics without thinking cuz its not something i have seen before and id be in shock,3
you are a horrible person,2
is old enough to know when something is insensitive or not,2
yikes his ego is in turmoil clearly a lost soul,0
why do they keep calling subs on yt followers,2
the real question is if youre so uptight about someone clear doesnt use youtube using the word follower instead of subscribers you might want to get off of here for a little while,2
no room for the weak in this world hey aaron the one who should be rotting in hell is the one who committed suicide plain and simple if you weak than please take the easy way out,2
followers on youtube xd its called subscribers miss,1
if youre so uptight about someone who clearly doesnt use youtube using the word follower instead of subscribers you might want to get off of here for a little while,2
me to,0
oh my fucking god shut the fuck up,2
he posted a clip of an adult that made a conscious decision to take their own life aka a loser or someone who is mentally ill,0
he didnt kill anyone,3
im fuckin sick of people shit on others for what they post,2
thats what the internet is access to information the more that gets posted the better i want diversity and both light and dark on the internet not just sunshine,1
post everything,1
fucking sjw crybabies,2
slap shot studios i know a few people who decided to take their lives i was the first to call them losers,2
life is fucking tough for everyone suicide is an easy way out,3
and its not what you take its what you leave behind people who commit suicide that have families are dicks,2
its a selfish act,2
and youre never gonna convince me that someone who takes their own life should be labeled a winner,2
sorry pal thats an uphill battle you are simply not going to win,2
good luck with your idiotic views,1
mathieu lafreniere dude hes fans are mostly kids so people are gonna get upset if he posts a video with a dead body and i cant wait for someone you know to commit suicide and for someone to call them a loser,0
im sure the mans family and friends wanted him to be known as the suicide victim in a he vlog,3
he didnt care he only cared when he got caught smh hes trash,0
what a sociopath no true remorse at all,2
little over dramatic dont you think,1
fuck off it was a while ago dumb ass,2
those who forget the past are doomed to repeat it,1
i get that he was a piece of shit but i dont get why everyone is so sad about that person who comitted suicide like who cares the idiots who comit suicide dont worth attention they are just narcissistic and egotistical and they care just about themselves and dont give a shit about the families and friends they left behind,3
fair point actually,1
lets go ksi,1
i remember when i saw the video with my cousin cece and we we where scarred for life,0
million followers yep the west is fucked period china will be nr and thats a fact,1
he reminds me jimmy saville he looks fucking creepy,0
he has million followers,0
seriously followers smh,2
its literally the same thing,0
followers on youtube,1
i mean accidentally show a suicide corpse on cam is one thing to mock the corpse is fucked up,0
eu posso matar ele,2
who else is after seeing video,0
he imma go visit the suicide forest,0
suicide forest ima bout to end this mans whole career,0
im not watching him i watch tanner,2
he or he,0
youtube lets wreck the sml one puppet abuse is worse than showing a dead body,0
has fuck more subscribers than him and he didnt do anything,2
every popular you tuber deals with a controversy one in a while can we copy strike pew die pie,2
he is always been an idiot but most people anywhere are stupid if you are intelligent you know you are a minority,2
do these people even watch youtube,0
how is showing a dead body on camera and posting it to a public website for millions of people to see spreading awareness to suicide seriously,3
its subscribers idiot,1
who cares followers subs who cares,0
why does he still have millions of subs,3
the same reason people are supposedly going to storm today area their zombie idiots who cant think for themselves and they just do what someone on the internet tells them to do,0
let me guess,0
your on youtube,2
watching throw back vids,1
and this situation pops into ur mind,1
and here we are,1
anyone search up pranks gone wrong and saw this,0
i know im late but this video made me yell dang like omg,2
he founds a dead body,0
come on get the camera,0
people need to lighten the fuck up and stfu complaining,2
i would off been soo happy if that fucking sick cunt got arrested they should to be honest,2
dont worry he filmed a dead body skin will return the favor,1
thats such bullshit he did it for views,2
tfw still not banned,3
i never liked he and always knew he was stupid just by looking at him,2
legend says that no one will see this comment,1
damn am i the chosen one,0
wrong,2
it was wrong,3
nobody cares what year you watched this in,1
the moral is he is and will always be a moron,2
a babys mind in an adults body definition of idiotic,2
reporter has million followers on youtube,1
me well god damn i though it was subscribers,1
he ducks m,0
i am not standing up for he but they blew this a little bit out of proportion i think we can agree on that,2
not really this was messed up,3
hard alexander im not saying it wasnt terrible what he did im just saying it went on for way too long and nobody unless you yourself kills somebody deserves to have that much hate and negativity towards them for a whole year and a half again im not saying what he did is not terrible and im not saying that most of the hate he got for it was wrong,2
really please tell me how showing year old kid his audience a hanging body and laughing about it live is being blown out of proportion the videos dont upload themselves he had time to think before uploading he played it off like an adventure and openly showed the body suicide aside are you fine with someone making money joking over your family members corpse,2
so they let people go into a forest to kill them selves but lose it cuz a guy filmed it idiots if u dont want people filming dead bodies then dont let people hang them selves in a public forest,2
btw i hate the guy i just think this particular situation is retarded,2
japans suicide forest is a popular destination and for anyone who wants to find dead body and film it for youtube videos and shows so look it up on youtube they have thousands of videos on it japan doesnt care they make money from tourists,0
youre delusional,0
its forbidden to go in there but ok,0
i know were im going tonight,1
i want to find this video just so i can dislike it,3
bro wtf its called a suicide forrest i fucking hate these soft ass bitches,2
where i can find the original video,0
i saw this video,0
why not watch it on bro,1
its called subscribers lady ok get it right jk,2
he is a mistake,2
fake news your a faker,2
col he did post the video,0
targeting an audience made of teenagers and children,1
nah just children,2
personally i think you are both children for arguing about such a small thing as age identity lol who cares the real facts are he is a piece of shit,1
lol but their not in a different category their in the same which is a fact not a opinion a opinion on age is basically kinda like oh year olds arent kids their preteens thats a opinion but saying teenagers arent children isnt a opinion even people think year olds are preteens but at the end of the day we are all children until dont know why you people dont get it,0
i love anime okay but in this instance we are referring to children and teens as a different category according to the main comment,0
that is when you talk about children and teens everybody have a opinion on who is a child and who is not how about and are they not children also and are adult teens but im still going to put them in the adult category,2
i love anime when we talk about teenagers and children we are obviously talking about young kids typically around and teens who are around age also teenage years go up to the age of,1
i dont see why people trippin he didnt kill him he jus got a dead body on video from what i see he realized he made a mistake and apologized and took the video down if it were for views hed really keep the video up there worse shit happening and ppl trippin over a dead body the body doesnt matter when its dead the soul is out and gone wherever he went i like he no matter what no ones says im tired of this shit,3
slap shot studios yea but i dont hold people accountable for what they did in the past unless its a murderer but even then when that person realizes their mistake is really important and these kids are gonna see stuff regardless this world is pretty ugly hec even disney has dead bodies in some kid cartoons so we really need to learn to move on but theres a lot of soft hearted people so that pretty difficult rn i understand its morbid and not family friendly at all but at the end of the day no one is perfect everyone makes mistake now hes growing and stuff so yeah,2
trey burwell you have to understand that most of hes fans are little kids and people are gonna get upset when he posts a video with a dead body to little kids,3
i probably would of shown the dead body too we see worse on the internet,0
the gold micro phone if most of youre audience was kids would you post a dead body,0
i didnt do it for views,3
so youre going to exploit a suicide victim to raise awareness,0
thanos on drugs you can tell who is serious and who is not he always acts like he is a nice guy while ksi admits hes a cunt when they are asked about their wrong doings,2
thanos on drugs i was being sarcastic ksi is almost as bad as he,0
allegedly,0
what are you smoking,0
jesus i wish youtube would just throw jake s youtube channel away,3
i am japanese myself but i honestly dont give a shit or two fucks that he did this i still watch his channel,1
paper i dont know i just encountered him,0
what a conversation laugh my ass off,1
sir alfred fuck you,2
kazuma bunch just tell me you little shit,2
sir alfred why do you care,3
million followers on youtube do you mean subs,0
lavander town music fits suicide forest perfectly,1
definitely a desperate attempt for attention a sub spike,0
he vs aaron,2
hmm,3
whyy aa watching this,3
this guy suck and is mean,1
again why is he so stupid to put that on the internet,2
i cant find the video can anyone told me is there a video of i cant see it in his channel,3
deleted for obvious reasons,0
im in why,3
why a lot of people dislikes him,3
gacha builder james because he posted a dead body on his youtube channel when most of his fans are kids,1
dang you got aaron hating on u,0
he posted a video targeting teenagers and children,3
bruh what teen watches this shit,0
the fact that hes popular at all on youtube or anywhere else just shows the depraved state of america,2
lmfao sad thing is the famous people that lashed out against him only did it for attention as well so in hindsight they are just huge worthless cunts that deserve as much hate as him i hope they all die soon,3
he said sorry its a ded meme now,0
that doesnt mean anything,0
you think this is bad filthy frank has cooked a bunch of dead rats even baby ones,0
this guy is a walking tumor,3
this is why jake is better,1
chris game episodes both he and jake are shitty people,2
kogan is an absolute idiot,2
i ment he p,1
i already saw this year ago on the news,3
filming the dead body was a good thing so people will know what happend to him,0
people were gonna find out anyways,0
no he didnt he knew what he was doing,0
its crazy to think im watching this in august and i remember watching that video and being traumatized i was at the time and i thought suicide was fine bc of this video i remember showing my sibling this video the part with the body i was a huge he fan and that changed everything,0
i thought his career was over and felt so happy,0
t k exactly bro thats it,2
thanos on drugs nah im cool in middle class better than being a rich moron also he isnt successful being successful means doing something you love the dude probably has to act like a moron for his fanboys who think hes cool but the truth is all of you are just money bags to him,1
my kids saw the video and i was absolutely livid especially as i lost my brother through suicide suicide is not something to be shown like this talk to the survivors of suicide and see whats left behind not doing what he did,3
why are people upset about this there are suicide videos all over youtube yeah their old but they still show,3
damarcus hode because those videos were aimed mostly at adults while most of hes fans were little kids,0
i will disown my kids if they watch this,2
joe no any jake videos,3
the news,3
who actually wants to see the vid to know what happened,0
has million followers on youtube,0
me you follow people on youtube,0
hey he toy story is out,1
guy has two first names,0
i dont think he did it on purpose calm down,2
okay nee ah yes because he went into a forest know for suicide filmed a dead body edited the video and uploaded the video on accident,3
angela song why are people defending him he literally showed a dead body,0
okay nee so what youre saying is he didnt mean to upload the video on purpose or he didnt mean to be disrespectful to the deceased on purpose clearly he was the one who decided to go to the forest film the dead body and post it on youtube which part of this was not done on purpose please help me understand cuz i really dont,2
he is such a dumb ass he disrespected the japan culture,2
followers,2
ive never liked he and now i hate him,2
million,1
oh wow youtube are such wimps,2
whos here after rice gums new vid,0
he i did it because i thought i could make an positive influence and raise the awareness for suicide,3
me smells like bullshit,0
lol i typed up beta squad and it said this was related what,0
honestly this got way too much attention people are too protective in america if you lived in syria kids are fighting in wars dead bodies littering the street,2
he is a narcissistic sociopath with zero conscience or real empathy what a loser,2
i can bet you i can bet you that if he didnt get all this backlash and hate that he would have never apologized for that video that he would have no respect for that person at all i bet you that he is a heartless asshole and that is where i fully lost all respect for him absolutely disgusting,1
to be honest i always hated him but i saw the video posted and watched it and saw the og video,0
if this video was age restricted this would get no dislikes,2
this is disrespectful he actually disrespected the japanese culture to like dude thats just wrong u crossed the line,2
to be fair the dude should not have killed himself in the first place tho i dont agree with hes actions,0
p do you not realize that well hes disrespecting a dead man n the took hes life and jake or he whoever this is they both disrespected a culture,2
rd bruh why r u so pissed off,2
honestly he was very disrespectful to the people in japan,2
he threw pokemon balls at people in japan,3
dark shadow heck yeah,1
luna animates youre still commenting on this when its old af,2
liss i know p,1
ya think,0
that dead body is he watch the film and youll see its the same woods,0
yall worried about her saying followers but not the actual problem,0
he shall be haunted by the person i am no sad that the person did delete,3
im ugly and sick,3
i want to die here in suicide forest,2
you alive still,1
well this screwed poor he hard and its almost gonna be years since this happened,3
trying to be cool you look like a fool wish you can commit suicide,2
i dont like he but he has got more clout then u,0
i bet is,1
very disappointed in,3
he,1
i question people who subscribe to he,0
he wrote the apologies on notes,1
never would watch a prick like him,2
wow hes so famous,1
pew die pie wants to know your location,0
they make face news everyday not this one however,0
allegedly they have video of it and time to grow up no time to suffer the consequences of your actions,1
first the,1
second james charles,1
whos next,1
he has million followers on youtube hmmm,0
best day of my life,1
start of,1
now to,1
sooner will be,1
heres a perfect song for this video,1
hes not a star,1
hes a messed up guy,2
why is there a forest with people who soes,2
why did he suicide,3
i dont freaking know hes probably depressed or something,3
mil views oof haha,0
fucking moron hes not sorry just sorry internet turned on him,2
filming a guy and joking about a dead guy,0
dude is a straight disgusting weirdo fuck i have seen a dead body and its no joke i couldnt look at it for more than seconds before i ran like a girl with chills that wouldnt go away,0
this makes me want to commit tree rope,2
