0,1
none of my girlfriends have ever said no youre not gonna play games youre gonna spend time with me omg,2
dude when she was trying to get his attention and was like baby whats wrong i love you whats wrong oh my god if i had a gf like that i could never ignore her id feel so bad,3
my gf would have done that shit then took the power cord,2
it made me feel bad she immediately went to asking whats wrong,3
give me that macbook bruh,2
my girl would have told me to go fk myself as she is walking away this girl is a cutie pie and so full of energy,3
wouldnt life be so much easier if girls had this energy all the time,0
wish i had a girl like that lol omg,0
doh ni badan pun aku ni,3
i watch this knowing im going to be jealous,3
im jealous not why he has a girlfriend but that shes such a dream girl like personality i want one like that aswell,3
maybe if you spent less time watching and commenting on youtube,0
mine left me days ago before we made it to months,3
well i guess she found someone better,3
i hope now she is happy without me,3
to be honest i miss her a lot,3
she look and this dude look at least,0
my girl would have slapped me about seconds in,2
fortnite is trash play cs,0
this guy gives me the creeps dating a year old girl is disgusting,0
grace is almost and zeus just turned yesterday,0
wats the name of the song she played,3
where do i find a girl like this,0
when he kissed his thigh he moved so fast,3
this man has gotta be at least his girl looks at most kinda weird,0
grace is almost and zeus just turned yesterday,0
holy shit she is cute as hell i need a girl like this in my life maybe some day i guess,0
bro she cheating on you,0
literally the cutest thing ever at when he leaves shes says no in the most innocent way,3
talking wont get a guys attention,0
i think shes faking it,0
she is kinda reminding me of marble,0
my ex would have lost her shit in minutes,2
lol weak im ignoring my girlfriend for years,0
but the thing is shes also ignoring me this whole time,3
dude youre lucky you have amazing girl,2
this reminds me of my husky when i dont take her out to exercise,3
your gf look like no hate,2
how can he do this damn,2
i couldnt do it i would laugh midway i was already laughing hard at,0
ok thats mean,3
i have done this prank and realized im single hmm,3
dont do such thing live,2
she sat on him,0
title song please,3
if i did this my girlfriend will start crying in mins,3
anurag rawat aww i hope i find a girlfriend whos that sweet and innocent,0
if your single dont watch this,2
i dont know whats worse the fact that his name is zeus or that puka shell necklace,0
am i the only who noticed she turned off the ps for him after he stopped playing,0
she did everything but grab his phone,2
my gf would have burned the house down with me in it by the minute mark,2
you little bastard put the camera there on purpose to have fun at night,2
i sub because of her,0
so cute also what was that song,0
zeus,2
kae m exactly what i was gonna comment,0
shit there should be a comma jesus is only used as a exclamation,0
first video ive ever seen of you guys your gf is so wholesome i couldnt handle the first minute of you ignoring her,2
oh your getting a call holds up foot to his face oh hes not available my life but no boyfriend,2
i died,0
what editing software do you use for your intro,0
see boys if you dont give them attention they give you attention,0
i feel bad for your girlfriend,0
zeus says nothing,2
if this is my gf and she said i love you like that i will lose,2
you own sweeties gf bro,0
she yelled at him like a dog,0
i could not ignore that,3
not my proudest fap but,0
some butt angle there like from porn thats what my friend said lol,0
why the fuck he lai down on laptop,2
who else watching these type of video because you dont have a gf or a bf,0
why is she so cute damn,3
a girlfriend like this please lol,3
you had a cute gf shes like a kid,0
shes years old,0
she wanted some and the guy was ignoring her,0
why do i feel bad,3
i was watching fortnite the whole time,0
she said playing fortnite with our stepbrother,0
omg she gave you a call out,0
am going to lick your foot bang omg,0
seriously tons of people might have told you you both are really in love with each other,0
swear chicks like my year old daughter,0
shes so awesome and i wish i had a gurl like this,3
a womans weakness,3
how the hell do you have your baby sister as your girlfriend i mean your girlfriend as your baby sister,2
shes the type u cant get mad at even if you are really mad lol,2
i tried this too,0
now i am single,3
really tired of the click bait prank videos,2
dude learn me how to keep your face so straight and dont laugh i would have laughed so many times and your girlfriend is so cute wish al girls where like her,0
a whole ass staring contest,0
i mean this is my first video i watched of theres and this is weird causes shes like,0
shes almost,0
for someone that is single as me,3
this video is forbidden,3
nooo that laptop,3
poor laptop,3
bruh if i done this on my girl and slapped my butt it would been over i would of left,2
this is like my little sis trying to make me laugh,3
but nope that wont work for me for the time,2
because i know she wants me to buy her something online lol,0
at first i thought shes your daughter,3
sorry,3
when she said babe whats wrong you were fine last night i was like hold up wait a minute,2
i need a girl in my life who fights for my attention like this,0
xuan thats not true,2
yep its hard to get one,3
i hope you find her,0
how in the hell did he keep a straight face,3
oh wait i need a girlfriend for that,0
fbi agent i cant help you on this one fam sorry,0
is this a bruh moment for all boys,0
luk koka this comments in the comments needs a lot more likes,0
for the first time in my life i wanted to steal a girl that belongs to another man sorry mate shes so damn cute,0
i dont think i can ever ignore such a wholesome female like grace,2
i hope i can find a girl like this one day,0
same asf,0
hope most of you guys find a girl in general,0
see and tell me,2
some random guy fucks grace zeus still ignores her,2
women have been doing this to men for eternity haha,0
haha fucking cute i hope my gf is annoying and cute too at the same time but shes only annoying,2
me as a girlfriend,0
poor laptop,3
real gamers dont need girlfriends,2
cries in corner,3
and guys thats how u lose ur girlfriend,0
no one,0
wish i had a girl like that,3
trying to be like this,3
such a baby girl want attention girl a baby,0
ada yang sama,3
romantic,3
ohhhh she tries so hard,0
ohhhh she tried so hard,0
team grace which are u,0
first time seeing this guy and i thought hes neymar,0
title song please,3
shes just so pure i wouldnt able to keep up the prank after the what did i do,3
is that your lil sister lol,0
if i was him i would laugh instantly,0
i find like this girl,0
i swear to god girls are crazy,0
shes crazy dude,0
it looked like zeus crushed their laptop,3
omg shes so adorable i cant,3
shes so cute tryna get his attention,0
anyone know what song was playing,0
anyone,0
how old is she she sounds lol,0
this is really mean,3
childish gf i like her,0
never play that kinda prank on her again its unbearable,2
i want a gf like her awww,3
when she sang i believe i can fly it killed me,3
she is so adorable she act as a years old child i cant stop laughing,3
why for some reason her behavior reminds me of hannah from frozen lol,0
i need a man like her who just wants my attention and to love me and touch me,3
thats so me if i wasnt single and people actually liked me,0
shes a spider monkey,0
i did everything but instagram because i dont have it,3
she is weird,0
wtf i thought his gf was little girl,0
you guys look like ana and elsa,0
i believe i can fly part killed me,0
i thought she was ur daughter,3
why do i have a feeling that shes too young to have a boyfriend,3
shes,3
hours,0
how its like when i talk to my crush,0
he is probably used to her using him as a jungle gym,0
when she said i am gonna put my foot in your face and pick your nose i about died just how she said it,0
grace acting like a house cat send help,3
me asf,0
whoa your name is zeus what thats a cool name son,0
also those pillow cases are really gross,0
owe,0
while zeus ignores her i wish i have a gf like grace,3
why did i just imagine grace as anna from frozen like,0
zeus do you want to build a snowman it doesnt have to be a snowman,3
tell the name of the song that music was playing on the background of your video plz plz tell,3
grace is so cute she is so funny i need someone like here,3
i need girlfriend like this dam,3
i need to find a gf like that,3
this should be called pissing my boyfriend off for hours,2
this is so cute i cant,3
during graces clip she said prank times lol,0
she enjoying more than you bro,0
i died,0
she looks like shes,0
whats up with girls and messing with guys nipples lol my girl friend does it all the time to get my attention drives me nuts,2
ur girlfriend is a year old in a older body,0
the problems of having a year old girlfriend,2
she has so much more patience than me,2
is it just me or does grace look like a high schooler,0
she so young i think,0
i dont have insta,3
omg this is the type of relationship i want,3
first video ive seen of you guys and im subscribing,0
please tell me the title of that song,3
how she so calm,0
hi fucker,2
man she climbed on him,0
grace zeus what have i done to deserve this,3
thats a wife right there bro u lucky asf,2
where do i buy this product lol,0
no one,0
not a single dang soul,2
mine one will directly plug off my ps lol,2
im gonna choke you out,0
grace staring contest go,0
she is so cute i cant omg,3
whats wrong,3
well here human named after god zeus got a girlfriend who is human but has got goddess like eyes,0
grace is such a person that altough her bf ignoring him but she still happy i think,0
she was so cute when she trying to got zeus attention,3
laugh my ass off why is grace me whenever my husband is playing games,0
aww i felt so bad,3
she reminds me of elsa doesnt she,3
thing i hate when people do is they ask the question over and over again,2
i feel bad for her,3
i swear we dont realize how much attention we need and get till we watch one of these videos there the cutest,0
shes acting like such a kid its so cute,3
king rock it cool im actually not lacking in the romance department especially in my past just that im not quite ready yet for it to happen because of financial situation i need to up my family before my love life theres a key for every lock out there youll find someone too let us not sell ourselves too short,3
lem manalo its ok man youll find someone unlike me,3
unknown what im here sitting on my almost y old ass and these guys look more adult than me i thought for sure they were like or,0
noor hidayat both are,0
if you guys break up its gonna be the saddest breakup ever,3
zeus wake up,0
hits with pillow,0
atleast she didnt get mad at him like i would have,0
i think its the first time i comment in a prank video but i have to say this,0
also how did she have so much energy to try and get his attention i would have said fuck it,2
grace had me dying the whole time,0
imagine being in college and wearing a size shoe mens size shoe,0
imagine if the chair just snapped and he fell laugh my ass off im not trying to be mean but it would be funny,0
i cant imagine how hard this would be,3
cant understand why hes not laughing i would have died,3
that shit would have had me dead,0
yeah for real,2
she said pranks times,0
i could not do this one i couldnt keep a straight face and two shes so w the i love you what did i do,3
i wonder how long she wad trying to get his attention,0
i know this is just a prank but if my girlfriend isnt this annoying when we together then i dont want her and she belong to the streets,2
how come at grace reminds me of anna from frozen when shes like the sun is awake so im awake,0
the worst thing about ignoring you got put up with them getting annoyed theres some girls that get annoyed,2
turning the game off works percent of the chance as long as y block it only then hell get annoyed,2
sorry if i should weird or rude but yall sound young,0
dang bro why grace so cute,3
i hate when girls say baby like bru i aint no baby,2
bro he is cracked on the sticks,3
she looks like annie leblanc,0
just shut off his pc and then see the reaction,2
i was literally watching him playing fortnite the whole time,3
shes like a little kid im dead,0
wtf was she doing,2
this mans was using the mech,0
when she started playing lemonade crunchy ice with his chest i giggled,0
i think there lying tho i feel like she new its suspicious,0
this is literally me anytime my bf ignores me lol glad to know im not the only one who acts like this,2
bf decided this was a good idea we live long distance i got suspicious and i thought he was cheating i drove hours to his house and he was just ignoring me i spent the next few nights at his house sence i was already there,3
oh hes i thought he was foot my dad is,0
i dont know how he can keep a straight face,3
this girl is giving me the biggest wow of my life she so cute,3
if i do this to my girlfriend,2
shed molest me,0
i love you whats wrong omg that was so freaking cute,3
bro i dont know how u couldnt laugh she was having fun by herself,0
oh my god surface,3
aww its so cute aww,0
a minute of silence for zeus back,3
why do the girls always come to the sense of something is wrong i dont know y,3
diet coke oh,0
because if men are angry or upset they will shut out everyone and women can normally sense that if they are a partner or sibling easier than acquaintances can,2
thats one energetic female dude,0
nigga was playing team rumble thats why he didnt geek over her blocking the screen,0
she lowkey looks and acts like annie leblanc,0
she looks he looks,0
this is her being relationship goals and he cant help to love her even if he is ignoring her lol,3
if you dont agree that this is relationship goals ill kill you the way she says babe and baby is the cutest and their relationship is everything,2
i have never seen such a cute couple,0
if i was here do what my gf did to me when to tried doing this blow in my mouth i laughed and said it was a prank,3
im just like,3
turn the damn fortnite off,2
my mum shut up,2
me oops,0
whats the song name pls and love u guys so much grace looks like judy hoops i dont know why,0
is she,0
youtube how many ads do you want,2
i need that kind of energy,0
youre not asleep wake up,0
bro i didnt get the notification for this video and im soooo mad this video is so cute,2
zeus a mech i lost respect for you team grace,2
she is such a cutie dont do that again,2
rip laptop in mourning rn,3
i dont have insta,3
u guys are literally the most perfect couple my heart,3
she is like a small children i dont know what i think about this because how old is she why she speak like a baby and why she do like that too but its soo cute how much fun she already had,3
times that u said it,2
these type of girlfriends are rare af,0
i wish i could win dollars for every whats wrong grace said,3
intro name,0
absolute silence,0
i wanna see how many dislikes this comment can get probably nothing,0
this is how many times she sed prank,0
bro shes so cute omg,3
zeus doesnt ignore me when hes mad who were u talkin too,2
i love it how she laughs and then right after that she goes back to asking whats wrong,3
zeus wanna play fortnite,2
she acts like a year old that wants candy and its a really cute reaction,0
i kept watching again the part where grace hurt her elbow im dying,3
aww she sat on his shoulders and stood on him i cant,3
doesnt grace look like annie leblanc like before annie died her hair i dont know never mind bye,0
she was having fun,3
fun stupid idiotic morons this is the sht that comes outta indiana,2
that blanket look comfy asf,0
you guys are so cute i cant,3
this called me single in every single language,2
my face actually hurts from watching all ur videos and smiling,0
youre on abc news ahhh,0
grace first you ignore me then u hurt me and dont kiss it oml im die,3
why cant all girls be like this,3
yall were on tv,0
she stood on him and i about lost it,3
laugh my ass off,0
zeus doesnt ignore me when hes mad hed talk to me she knew what was happenin,2
she would annoy the shit out of me i would be like fine be like that and fuck of somewhere else,2
so i did a lil editing and i slowed the clip down of her reciting her speech and lemme just say it was beautiful,3
is she or,0
if my boyfriend did this id start crying,3
she was so cute i felt so bad,3
shes still so sweet tho i would be throwing hands,2
she is so cute and adorable and funny i loved how she was doing all kind of weird stuff wish i had a girl half as good as her just half as fully pretty and adorable,3
what was the song name at,0
it remind me of that,2
i was just thinking of that,3
blows on tube thing,2
hits head on fan,0
sits on him,0
kiss my elbow first you ignore me then hurt me and you dont kiss it,2
recites speech,3
is this hug time hugs,3
taps his head with her foot,0
sighs dramatically while rolling backwards on his back,3
slaps his butt,2
bulldozer pencil rolls over him,2
hits violently with pillow,0
this is hilarious i lost it when she blew on the tube thing xd,0
hits head on ceiling fan,0
dude yo girl is crying af,0
i love how every other girl would get mad but shes just doing gymnastics on him,2
shes dying for his attention,3
shes so innocent omg i have no idea how he held in his laughter for so long,3
your not asleep wake up well you cant wake up if your not asleep,0
these two are actually the cutest,0
why is grace the cutest being alive,3
whats that song,0
i got triggered when he was in a mech,2
ur not asleep wake up,0
she looks he looks go awf tho,0
grace want me to read you my speech,0
aka this is a representation of my mom ignoring me when im trying to see what she thinks of my essay,2
how the heck did he keep a straight face i couldnt stop laughing she was like a puppy who needed attention,3
just based on this i can tell yall got freaky after this vid,0
is it just me or does zeus look like colton from the bachelor,0
no one talking about how he got a victory royale with this happening and i cant get one normally,2
from she looks a bit like annie leblanc is it just me,0
omg you guys look like nick wild and judy hops,0
are you mad at me my heart broke,3
vaya si no lo lo,2
how old is grace she looks like,0
i dont have instagram but i did everything else,3
so hard not to laugh lol,0
she said prank times,0
grace looked like she had adhd in the whole video when she was tryna get attention,0
sorry but how the hell did she get from his knees to his shoulders,0
grace what song was actually playing,0
hello,0
omg grace was being so cute,3
she is exactly like my cat when she is hungry,3
other girlfriends slaps boyfriends to get their attention,2
grace stands on his legs what did i do,0
no one,0
absolute no one,0
i thought grace was annie mean they sound the same and everything and she looks like annie but when she is going to be older,3
how does this have dislikes smh,2
boy its too hard,3
omg shes so cute,3
awww her reaction,3
grace wake up smacks with pillow,0
this is actually how i am as a girlfriend when i get ignored but after a while i would probably genuinely start crying,3
i love the immediate are u mad at me i felt that,3
bro how tf did this man still win,3
she said st your ignoring me nd you hurt me and now no kisses,3
why was grace acting so cute xd it almost killed me how can he ignore her like that,3
this is how many times grace said prank,0
shes so cute i cant,3
wow u look like neymar,0
how do u ignore people for that long,3
poor grace,3
this sounds like a fight betwen me and my brother,2
sooo,2
girls need attention and this proves it,0
sorry guys so dont have inta ill never get any merch,3
i am definitely on graces team lol and does anyone know if the exchange student is still with them,0
grace said prank times,0
notice how any other girl would start throwing a fit and cursing and threaten to break up grace is just tryna get a little fun out of it team grace or team zue,2
damn women are needy,2
how old are they,0
grace was being so nice about it,3
oh my god hopefully they never break up,3
but hes good at ignoring tho,0
this girl needs attention xd,2
literally fake she said zeus doesnt ignore me when hes mad he talks to me,2
shes like a little kid lol,0
he was using a mech in fortnite please dont be one of those guys lol,2
shes too fuckin cute to ignore,2
wow you cant find any girls like grace anymore,2
ill have to put the camera somewhere she wont see it,0
yo he lowkey just straight up dissed his girlfriend,0
whats your ps gamer tag,0
cant you do the pass out prank or the drunk prank,0
grace staring contest go,0
this is like grace climbing on zeus for minutes,0
how old is this girl,0
i feel bad for that computer that was get dog piled on,3
bone gamer pro likes now dislike,3
she is broken,3
bone gamer pro why u,3
she has so much energy,0
ha you got sniped,0
ow hits head on fan she is short but im to short for that,3
why you use mech,3
i did all the give away stuff x,0
omg they liked my other comment ahhh,0
aww i feel so bad because she is such a sweetheart,3
wow you are so much taller than grace,2
wait she a girl,0
no zeus dont be like that why do you use the freakin brute,2
shes mental,0
how old are they,0
ashley gutierrez apparently they both were born in,0
what song is that,0
anyone else thinks she looks like annie leblanc,0
grace kinda looks like an older annie leblanc,0
in the sweetest voice im gonna choke you out,2
i died,0
first you ignore me for no reason than you hurt me and dont kiss it omg shes adorable how did he stay strong i would have cracked right there,3
when she uses her foot as a phone,0
one second ger name is grace and his is zeus you what their sons name os going to be,0
jason grace,2
why is grace such a mood,2
grace is like a puppy trying to get their owners attention i bet all this things are running through that puppy head,0
gonna choke you out,0
he went she went,3
damn she called the f cops,0
wow first time ive hear zeus talk,0
grace still has a child heart,3
shes too cute to be ignored,2
how old are you two grace looks so small compared to zeus,0
your not asleep wake up laugh my ass off,0
what did i do to deserve this nothing,3
i dont know how zeus kept a straight face i would have been laughing that whole entire time,0
i laughed the hole time and i died at,0
serious grace look like and zeus,0
khushi singh yes good question but we dont know,3
by the way how old are they actually,0
im sorry but they are honestly the cutest couple on the planet you can really see how much they love each other i cant wait to see what the future holds for them,0
you said prank times,0
i love how grace sits directly in front of the computer yet still tries to play,2
grace looks a little like annie leblanc i dont know if it was only from the top angle or is it just me,0
grace is so cute and sweet she dont deserve that,3
youre not asleep wake up,0
grace,2
you can tell she was bored,0
bruh was in a mech lol,0
she lowkey looks like annie leblanc,0
i love how she zipped your thing up and was like ya thats funny now talk to me,0
where do you find women like this,0
hey just finished doing the giveaway cant wait to see who won and am the only won wondering how she did not brake his back cause i was worried when she went on his back,0
i cant thank god it s friday made me so sad,3
grace wont pin this,3
every one is watching grace use zuse as a jungle gym while im wondering how graces pants havent ripped after she was doing all of her gymnastics,0
my heart,3
grace is just so cute she has the best patience and i cant believe zeus didnt laugh,3
this is my favorite ignoring my girl friend boy friend video yet shes such a sweetheart dont lose her,3
her skin is so clear i cant,3
grace is legit acting like a crack baby i am dying,3
i was giggling but he was,0
u said prank times,0
i would just take his laptop,3
lol i would have played with my boyfriend and set up my ps next to his ps gamer tag,0
your not asleep wake up smacks with pillow,0
awww i love grace so much i feel so bad watching this she deserves it but shes an angel,3
can u do a eat it or wear it challenge,0
do a im pregnant prank like to agree,2
can you go live on yt,3
whos team are you on,0
this is the most adorable thing ive ever seen any bad feelings i had before watching this are completely gone,3
jumps on him,0
what did i do to deserve this nothing,3
grace absolutely knew what prank it was all along its way too obvious,2
what is the song that plays at like i cannot find it,2
anyone know the name of the song at,0
done,0
i give him credit for not laughing while she was bothering him the whole time,2
i litter lay act like this,3
when you ignore your woman,2
the second she came into the room i broke i love them so much ik its a prank but i love them,3
poor grace begging for zeus attention is literally me trying to get some attention,0
u said prank times,0
i still want merch when will we know,3
grace dancing i think so,0
i died,0
she really just got on top of him,0
theyre the cutest wtf,3
why does he have a dog name,3
grace are you mad at me what did i do to deserve this,3
im done,0
omg then she starts dancing my heart,3
omg she got me dead i live you guys,0
edit grace is me when i dont get attention laugh my ass off,0
how old is she,0
whats the song called at,0
damn she seems light,0
ive liked and subscribed but unfortunately i dont use insta so i guess i lack the eligibility criteria by the way i like the videos u guys post so keep up the good work peace,0
well she knows how to keep herself entertained lol,0
i wouldnt be able to keep a straight face,3
when she pretended her foot was a phone i lost it,3
e girl ew,0
she realized hes ignoring her immediately how is he going to go on for hours,3
shes probably the only person ik who elly cares that much about her bf,0
