I was thinking the same thing.	3
i hate how fake these are idek why i watch them	2
Ive watched this over and over again 	3
My heart broke for him	3
omg i already know by the intro	0
I cant believe Nate had a knife	3
I WANT IT TO BE MY NAME!!!! PLEASEEEE	3
kinda think its fake bc they always prank each other	0
She kills me omg 	0
I wont to join that fan of the week	2
Y'all don't know how many times I watched this	0
I LIKED ALL YOUR VIDEOS PLS PUT ME ONE THE WALL I WANNNNNNAAAA BR ON THE WALLLLLLLLLLLL PLS	3
I've done everything MANY times to get into the giveaway. WOW... JUST WOW	0
Omg i cant believe her name is karissa that is my nane just with a c (carissa)	3
This pranks and content is so fucking trash and shit.So fucking cringe	0
If he wants karissa to do the same thing she was doing to the doll she has to clap hit her leg and open and close the Bible	0
I WANNA WIN..... if I can....ohhh its stil recording fuck..... ups sorry....	0
I want my name for fan of the week	3
Nate:" i just wanna f****** talk " 	0
* while holding a knife "	3
does karrissa have a yt acc cuz if she does  what is it??	0
He had a freaking knife	0
My name please	3
I want to win that fan of the week real bad!!... omg Im so cringy	0
Dang fr that was shit good	0
no one:	0
suuuch a good prank!! i feel so bad for nate tho when he said "what did i do" omggg	3
I feel like the pranks are kinda fake bc they do one prank each fucking day so Nate or Karissa should always expect a prank. Unless is like the earthquake one. But it really takes the naturally off the pranks. No hate tho, I love them.	2
nate just going crazy when he know karissa was 'CHEATING' on him	0
Meghan I am your longest sub ever because I have been here since the day you had your first vid. I want to be the sun of the week.	3
I want to be on the grass wall	3
I HAVE MY NOTIFICATION ONNNNNNN	0
when he oncovers Brittany. me:it's Brittany bitch	2
to get her back you should do a prank were you get shot and tell her how much you mean to her and the fake die in her armslove you guys	2
I feel so bad for Natebut that was a great prank. 	3
Dunclan win this one mate sry	0
I feel bad for Nate	3
but why am I laughing 	3
poor nate	3
The cringe level is high today boys	0
You guys are pranking each other all the time with all these cheating pranks, so how the hell dont you ever get that these are pranks..? It just feels very fake	2
I would have just sent him a picture of me with the crown on and said okay if you wanna end this over a prank as your smiling	0
 Done	0
Ok but what if he hit her with that water bottle... 11:56	0
Poor Nate awww	3
P.S. srry im late I fell asleep	0
Edit:I love how Karissa literally said im not gonna show yall yk the ppp...po...porn and im like I hope you dont 	0
Wow,He got a knife 	0
This was a good prank!! But I kinda feel bad for Nate..	3
Hope I my name can be on your board!!	0
ah, i remember pranking my ex boyfriends but all of them were pussies and never could take a joke and decided to break up with me...	2
Dude. I WANNA BE ON THAT wall thingy what HAHAHA 	0
Can i please get a shout out	3
He knew the camera was there	0
I wannna winnnnn	3
Dont end the prank wars T-T	2
I WANNNA WINNNNNNN!!!!!	3
That door wouldve been busted down if my future bf ever pranked me like this	2
I also want a IPhone	3
I WANNA W-w winnnn	3
I want to be FAN OF THE WEEK please choose me 	3
I was so dead when nate took the knife	0
I died when the meme that said you need Jesus	0
Im the only one who wonders what he was going to do with the knife	3
I do soooooooooo bad I want to win the fan of the week I never get picked for anything I even suck at bingo 	3
Because Im dumb	3
I want my name there	3
I want to be on the big W wallll!!!!!!! Pweaseeee???	3
Thank you I had such a bad day 	3
HAHAHAHAGHAGAGA BITCH NATE PUT THE DAMN KNIFE DOWN BOY	2
so nate, i wanna win that fan of the week...thing	0
all these pranks are so fake, every si gle one of them im unsubbing	0
brooo I wanna be FAN OF THE WEEK	3
I WANT THE FAN OF THE WEEK 	3
Nate was gonna murder him	0
i knew it i wont win	3
Give him a hug	3
Nate grabs a knife omg 	0
It broke my heart when nate entered and his voice broke.. But at the same time he loves karissa a lot !!! Nate bro u gotta take the prank crown back bro #garner gang for life	3
I....want.....to.....win??	0
I know this is fake but why do people always blame the person they are cheating with. It's all the other partners fault that they are cheating with someone  because they aren't loyal  	0
I wanna winnnnnn	3
these pranks are fake they do one every day	0
I wanna be the fan of the week 	3
I like that Karissa is clapping the whole time then saying this is a great vlog. Then Jesus was involved . Then Nate asked what were you doing Karissa straight up said I was watching porn. If I were Nate I would ask what was the clapping noises?	3
I want to be the fan of the week pls	3
Karissa doin the noises to make it more realistic lmao 	0
You guys do pranks every video how do you not know its not real?!?!	2
Hope this man enjoys getting dirty cash by manipulating the minds of children. Literally a more douchebag more new age fouseytube. (I have too much time on my hands)	2
And if he didnt know it was a prank how would he trust her in real life ??	0
10:00 he was like ARE YOU STILL GOING???	0
Poor Nate	3
They have done so many pranks how didnt he realise it was a prank.	0
This doesn't seem fake like the rest negl	0
That was a big knife Nate! At 10:04	0
*i just wanna talk* - holds knife	3
and i want to prank my bf but idk whats his weakness, he's too calm	0
I WANNA BE THE FAN OF THE WEEK	3
I want to that person in the wall	2
nate should prank karissa by saying he thinks he's GAY!	2
or karissa say she's lesbian	0
Wow that was a real good prank	0
can i be the fan of the week please lol	3
What is going on 	0
i cant get over how cringe and fake all these pranks are lol dont understand why they dont do legit pranks like ace family	2
Karissa should have used the Elvis wig on Britney	0
I want to be the fan!!!	3
i wanna win the fan of the week thing thx for giving me something to comment i always comment and i always like and im already subbedc with notification bell anyway	0
I think u should stop the prank wars and started making content like challenges or anything else. Just sayin	2
Steven : im just afraid people will label him homophobic when he reveals that hes 100% straight in the end, it happens a lot	0
I'm gay and I would not be offendedthat would be hilarious	0
i subscribed like 9 months aggooooo	0
Our girl Karrisa damn... 	0
The neighbors must be so concerned	0
I DEAD ASS STARTED CRYING FOR YOU	3
Im pretty sure these pranks are planned and all the reactions..... because they do too many besides nate knows she wouldnt do that to him ... this is literaly pranking the whole week how can both of them not expect them	2
This was fuck harsh girlayy atleast you got tht crownnnn and sorry nate this must have been so hard for you to processLOVE YOU GUY'S 	3
I WANNA BE THE FAN OF THE WEEK PLEASEEEE NATEEEEE AND KARISSA	3
Pregnancy prank, come on	2
Can i pls have my name on it because i have like ben here for like 3 year's pls	3
not hating bc i love them but just saying lol	0
Can I be the fan on the week please	3
how many pranks do they have to do to each other before they stop believing they're cheating on each other	0
nate : yes ive been here for f*ing 5mins open up 	2
im dying	0
*has knife in his hand*	0
Nate: I just wanna talk 	3
I really wanna be fan of the week so BAD  I LITERALLY WATCH YOU ALL THE TIME  please notice me  	3
I want to be on the big W wall 	3
I felt so bad for him but it was funny  you two are so cute together	0
But I miss the kidnapping prank but this one 	3
Also Nate: *grabs a big ass knife*	0
So sad :(	3
OMG HE CRIED	3
I wanna win a new iPhone 	3
i love you guys always... BUT.... i think u guys kinda tricked a bunch of people to get u subscribers and then out of thousand of pple that helped u out. u only picked 15 pple to be in the givaway? u never said oonly 15 pple will be eligible. all u said was like this video, subscribe and geta friend to subscribe to be in the givaway. that aint right. like if u agree!	0
It was REALLY EPICCCCC  deeyym 	3
This was too much	3
Hm I just noticed that Nate kinda looks like Gu jun pyo from the Korean series Boys before flowers	0
You still taking tests?	0
LMFAOOOO I COULDNT STOP LAUGHING HOW OUT OF NO WHERE THE "YOU NEED JESUS" CLIP POPPED UP	0
Policy of Unicorns Yeah actually I live in South Africa and like were  still in school so yeah and its still winter here	3
Emm. I have seen those shoes. Im sure it's fake	0
Karissa is a waaaayyy better actor than Nate 	0
Omg the best couplehe was crying love you guys	3
I can not stop rewatching this!!	0
When he banged his head I lost it	3
Nate: yes, for 5 mins ... 	3
Karissa is zeeee queenwill...Nate, you broke my heart but Karissa made an epic one 	3
Idk why people think this prank is fake	0
dude got a knife ready to chop some dick	0
I feel like you guys drive each other crazy  I can honestly see why YouTube relationships arent healthy	0
How do people believe these pranks!? There so fake! Like they upload three pranks a week even if they where trying to make it realistic it just wouldnt be after so many pranks!	2
Its so cute how Nate cares so much aw	0
"I wanna go to the womb. I hate real life" I felt that in sooo many levels fr	0
I want to be on your fan wall	3
These are definitely going to end up married 	3
BTW subscribed turned notification on and shared this video to my friend group 	0
That knife was HUGEEEE	0
Lol I want to win and have you guys deliver to me lol... Hello from MEXICO  #fanoftheweek	0
Nate: *grabs knife*	0
Also Nate: open up i just wanna talk	3
Been here since 20 subs. 	0
10:58 is me walking to the kitchen at 3 am to steal the food I was told not to...	0
Okay I reallyyyyyyy want to will fan of the week	0
He was ready to stab a nigga	0
Boy she is blonde i was also in love with a blond girl and she treated me like sh*t man break it up with her before she does it with you	2
I want to be on you're wall	3
I have never felt like Nate before...	3
By that I mean, crazy with the pranks and really afraid of being cheated on...whatd you think?	0
Oh my god..... these pranks get worse and worse. Can no1 see these are fake??????	2
I wanna be the fan of the weeeeeeeeeeeeeeeeeeeeeeek	3
My heart in my balls	3
karissa's face when she saw the knife had me dead	0
Oh my god that was such a good prank, but I felt so bad for Nate. Damn I love both so much #garnergang	3
Omg I was laughing the whole time at Nates reaction why did he grab the knife was he gonna kill someonebtw I love you guystaken BIG WS	3
i wanna winnnnnnnnnnn	3
Omg this is amaze	0
I cried when nate cried	3
I need a nate to my Karissa	3
I started cryinggg	3
I have no words for this couple... Everything that they have accomplished should be everyone's couple goal... 	3
Brooo what's with the knife 	0
Fan of the week?	0
I wanna winnnnnnnnnnnnnn	3
C'mon i don't wanna do something just kill you	2
thats a big ass knife bro	0
Put me bro please	0
i wanna be on the signnnnn love u a lot	3
Poor Nate  WOW Karissa really IS the prank queen (who else teared up because of Nates reaction so sweet)	3
I wonder if he really doesnt trust her or if he is just traumatized from the past. This is like such a big fear of his 	3
Karissa you killin the prank wars :)))	2
Aaah it's fake 	2
Post notif onlove you guys	3
15:00 same I want to go back to the womb I hate life 	3
I want to be on the grass wall!!	2
My dog barks along with Max 	2
Omggggg immm deadd literally theee bestt thing i have everrr seen	0
 Wanna win so bad	3
And i oop	0
If this is not working my dog died  and I bought a dog like yours	2
I LOVE YOU BOTH SO MUCH XXXXXX NEVER DO PRANKS LIKE THIS AGAIN!!!! NATES REACTION BROKE MY HEART	3
nobody: 	0
Not a soul: 	2
Also Nate: *holding knife*	0
Lmaoo	0
My mom does that, but with a belt instead.	2
B a n a n a CAUSE YOUR DUMB	0
Awww I kinda feel bad for him. This was funny 	0
I'm so glad I was home alone when I was watching this 	0
They always fake cheat or test each other for cheating	0
Karissa: *makes noises*	0
Fake prank	0
Omg stop it 	2
Nate : what did you just say?!?	0
I cried	3
me: nah uh, I'll watch this when my mom's not around. she'll think i'm watching that	0
I love uu!! but its too much no??  I mean how long it takes, that somebody dont want this anymore? i hope you will always love you,! And be togheter!	3
I WANNA BE THE PERSON OF THE WEEK. For the iPhone giveaway I commented on all the videos liked them followed and subscribed it would at least mean something to get my name  on there	3
Lol I just can't stop smiling 	0
OH MY GOD 	0
Aww he was shaking bless him xx	0
13:32 "I hate that i love u" awwwwwww 	3
Too much. Way too much. Oh my goddddddd no please dont do this again	3
imagine karrisa in the room alone while smacking herself and moaning HAHA	0
I'm on #teamkarissa but I feel so bad for Nate 	3
You got him really good karissa but my heart hurt for nate  just don't let these pranks affect you forreal 	3
That was so intense hahah	0
Did you break up?	3
Im so surprised they never stop and think this may be a prank after all the pranks theyve done to each other?	0
I wanna be in the grass wall please	3
watching you guys makes me feel extra single lol	3
First prank i actually liked that crown is never going to Nate again.	2
Seeing Nate get so sad and angry was heart braking, you can tell how much they really love each other!	3
Thats so sad HAHAHAHAHAHAH but funny	3
Omgosh I'd be honoured to be fan of the week. I miss you so much when you don't post x	3
Nothing ever gets between you two not even BRITNEY	3
The I just wanna talk with the knife was epic!!! Lol  	3
Lol that should go on the board! Haha 	0
Hope i win the iphone giveawayyy	0
He better gets her back goooood	2
Im looking at all your videos	0
Aww bless him !! Haha	0
You nate surely will dump the damn grey man	3
Can I be the fan of the week my name is jenny I've  been watching you ever since you started YouTube	0
ok but the knife though	0
Give me ur pubg id	2
Dude how can u just slam on the door while ur girlfreind is in the room with someone else...i would have broke into  the room with a buldozer	2
I really want to Winn!!!!! 	3
I want to win that name thingy please I wanna win so bad 	3
Watching this breaks my heart ...but it was a good damn prank karissa 	3
Done done doneee	2
Bmt no disrespect but how did put muscle you and close the door on u 	3
*that knife* oof	0
I wanna be the fan of the Week  love you guys so much 	3
Tbh Nate looks a little bit like Thanos	0
Damn Karissa  you genius devil  better get her back Nate 	2
I snobody acknowledging how max was ready to back his dad up. 	3
Me: DEAD 	0
Nate: I just wanna fucking talk *Knife in hand*	0
Pulls out knife	0
Im happy you werent doing that you fucken bitch 	2
i seriously repeated nates reaction to britney abt 16 times	0
i cringed so hard	3
"fuck.......you!"	2
LMAOOOOOOOOOOOOOOOOOOOOOOOOOOOOOOOOOOOOOOOOOOOOOOO	0
i thought it P*rn channel that has their home p*rn in right in down at 15:34	0
This guy pulled out a knife.	0
@Katrine Baqaeen true but I don't see any actual harm in the act. I believe it wasn't ment to disrespect or offend anyone. Just an innocent coincidence.	0
That's not funny playing with religious stuff even if they don't have a religion or they are not religious they should respect other's religion	2
I wanted to win so baaad	3
I feel bad but this was funny! 	0
"I just want to talk"	3
*is holding up knife	0
LmaooI just wanna talk*with knife in hand*	2
Aw man. This was rough.	3
Why they be doin a prank video everyday	0
I want to win this iPhone	0
Everybody wishing they had a boyfriend like that. He was so sad it made me sad.especially when he was like "what did I do to deserve this?" Aww, I am shook lol. Good prank though lol.	3
you understand its staged and fake right to the most retarded degree	2
I wanna win but I wont win	3
My question is if there was a guy there would he kill him with that knife	0
He was broken 	3
I just wann say	0
Lol it so funny but so messed up 	0
Nate: I just want to talk *holds knife*	0
I wAnNa Be ThE FaN Of ThE WeEk PpPlzzzzz	3
I had turn this off cause my dad came in to the room	2
Me too	3
Same I was watching this then my dad came in my room and I tried to click out 	3
I had to turn it off cause my older sister walked in the room lol	3
I wanna be the fan of the week. And where can I buy gods balls?	3
Nate with a knife: I just wanna talk 	3
I WANTTTTTTTTTTTTTTTTTTTTTTTTTTTTT MY NAME ON THE GRASS BOARD REALLYYYYYYYYYYYYYYYYYYYYYYYYYY BADDDDDD!!!!!!!!!!!	3
Karissa got him good,But i kinda feel bad for Nate	3
thunderdrake13 whats fake the prank?	2
Eva Hristova Bruh this is fake...	2
I mean, you guys always do pranks to each other, it is obvious to know that she is fooling u! Like come on	2
Pick meeeeeeeeeeeee	2
This was soo sad to see Nate like that 	3
I Wanna whin the fan thing!!!! 	3
Good god karissaa i hve to turn down the volume lol on this video	0
*_THESE PEOPLE ARE OGS OF Nate Garner_*  	2
THIS IS THE TEN BILLIONTH TIME IVE SEEN THIS COMMENT! COMMENT SOMETHING ELSE FOR ONCE!!!	2
What is an og?????	0
That Nicholas is so lucky af	3
(Actually I Don't Care About That....)	2
I Have Turned On The Notifications	0
(Gr8t I Can't Find A Bell Emoji)	2
aye bro...BRO...im depressed...found a way to cure it by watching the his vids. jk it dont help but it do put a smile on ma face	3
I wanna beee the faaan of the weeekk	3
When he rushed the door I jumped	0
This was almost too far... I was high key scared.	0
I want to win please	3
I'm dead	0
1) He broke his headphones for this prank.	2
2) The way he said, "What did I do to deserve this...?" shattered everyone's heart.	3
3) This man was not playin' when he picked up that knife.	0
Me: And I oop-	0
@Dora Winifred Read I-	2
Karissa:  Open and closes a Christian book   stop it	2
"I really like him!" 	3
Fan of the week  is such a good idea  wish I could be on their  love you guys x	3
Awh I felt bad for Nate when he was in tears it's so cute he cares so much about her you two are a cute couple and I'd hate to see you guys end it again 	3
I wanna Winn!!!!!!	3
OMG if I had a boyfriend if he locked the door I break down the door like U naw die!	2
Does Karissa have her own youtube channel? If not she should make one	0
"I just want to talk " while holding knife 	3
Nate: tO fUcK yOu uP ! 	2
This was a big one 	0
Alright... so Nate might be a secret serial killer... or ya know. He was cooking and just wanted to talk. 	0
I want to have my name on the wall thing 	0
I want to be fan of the week	3
1 Question why was he holding a knife saying I just want to talk. And I was talking to my sister and I said *if she opens the door and he has the knife and he walks in and just stabbed Brittany *	3
Change the channel name so dumb	0
He had a knife?! 	0
Im subscribed and I like every one of yall a videos hahaha. I want my name up thereee.  Even if I dont get my name up there I want yall to know that I appreciate YOUUU.  I love yall so much.	0
Good prank!! But man his face melted my heart. Such a great love he has for her, that they have for each other. But man this went beyond the line. Even Nate was like damn, do I even know her? for like a solid 2 seconds lol 	3
But for real, the fact that this does happen to people is whats so sad. People are actually this cruel to do this to another human being and cheat. Those people fucking suck. And Cheating is NEVER OK. Just break up with the person and then fuck whoever you want. Let the other person just move on from you instead of dealing with this trauma and possibly developing ptsd. Yeah, its THAT traumatizing as you just saw - and it wasnt even real!- Cheating isnt and will NEVER be excusable. Get that STRAIGHT.	3
He's so cuteee when he said I just want to talk but with a knife in his hand he is so brave no ONE misses with his stuff	3
I wish to be the fan of the week	3
He said he would never do that to her yet he did the exact prank before except hers was better no offense 	0
Omg I wanna be fan of the week	3
It looks like Nate has a pimple on his lip or a herpes	0
15:00 I wanna go back to the womb, i hate real life	3
*cries in relate*	3
Bitch I better be on that wall	2
This was one of their best videos. You can just tell how hurt Nate got. He is really in love with her. I hope they last forever. 	3
I wanna be the fan of the week!!!	3
i wannaaaaa winnnnnnnn	3
This prank was hilarious  and missed up at the same time because nate went from reallyly to kill somebody with a damn knife to crying and watching the sunset  damn karissa never cheat on nate he really loves u  i really hope i win the next give away 	0
This feels fake tho still funny	0
Nate get Carissa a puppy	3
 I was watching porn 	0
I been done #fanoftheweek love you guys	3
I've literally been screaming this whole vid but 12:12 OMGGGG	3
I want fan of the week I love u guys	3
W               WW                W	0
I want to wain	3
Are u there?	0
I really wanna hug nate when he find Britney..	3
I want that SIGN!!	3
I think karissa has got out of control with the pranks..	0
" I just wanna talk".. Lol with a knife bruh	0
Is this fake?	0
Brooooo she took it to the highest level 	0
That was nice! OMG	0
how did Nate know Karissa was watching something in there?	0
Awww I love the way they can pull these pranks on each other and still be madly in love. Meanwhile Im over here on a single streak for all eternity, and watching YouTube alone at 12,  love my life #singleforever 	0
At this point they know theyre pranking each other when its all they ever have for content  ooop	0
Omg I smiled so hard in the end my face hurts! 	3
Nate put the knife down	2
watching you guys every single day  	0
Oow my god stop it 	2
What the fuck did u say?	2
Whos this wanna be Jake Paul	0
Max be like: mom dad pls stop fightingggghhhhh	3
Bro he got a knife, he went crazy	0
    !	2
Bruhh is it necessary to moan while kissing?!	0
OBVIOUSLY fucking fake but OBVIOUSLY stills fucking entertaining so still fucking watching. Fuck these two.  	2
When he said You know Im here dude that broke my heart	3
The whole time watching the prank ..I was genuinely scared  I was like oh shit ..anyways I love you guys so much and I have been watching your videos since the start and you guys always put a smile on my facelove all the way from malaysiaaa	0
I want to be on the wall 	3
I Wanna Win an i phone	3
HAH WHEN I SAW THE KNIFE IN HIS HAND I WAS LIKE OH CRAP THIS STUFF BOUTA GET REAL 	0
I wanna be on the wall and I love you guys	3
Me: whats in his hand?	0
Nate: a knife!!	0
its prob not the first time nate has heard those sounds	0
This is a banger video ...karissa took it to a whole other level .. #garnergang	0
That was REALLY intense 	0
I wanna be on the wall sooo bad	3
I wanna winnnn	3
omg HAHAHAHAHHAHAHAHAHHAHA	0
FUCKING KARISSA IM CRYING  you need Jesus  The fact shes slapping her leg .... Im wheezing 	3
I want to be the fan of the week  plsssss choose me  i watch all of your videos 	3
all these pranks are literally gonna break you one day & yall will just grow further apart  typical yt couples	0
I just wanted to talk with a knife 	3
I wish I could be the Fan of the Day	3
Y'all have me dead asffff #garnergang	0
yall should make merch with the "cuz ur dumb thing with yalls faces on it	0
Not to be mean or anything but these people have the most fake life going on	0
Also me after the video-	0
(Guys this is a joke in case yall were wondering)	0
13:02 i luv how Karissa casually just said  *I wAs wAtChInG pOrN*  	0
same i laughed asf	0
Ned Leeds who?	0
I felt so bad for nate...Like I almost criedkarissa has officially won the prank wars...GIVE UP NATE!!	3
I wont to when	2
Yall make the day better	0
I wanna be the FAN OF THE WEEK	3
I never understood why people do cheating pranks like are you trying to make you boyfriend mad or are you trying to make you girlfriend cry	0
We all appreciate the big W , ... + is cute how his biggest fear is basically losing you... Or not having someone like him to take that big W. 	3
Nate you should react to Chaz Smith pronouncing things wrong ! 	2
I want to f****ing win this fan of the week.no to much alright but seriously I want to win #teamnate	2
Im sorry but this...... well..... HILARIOUS!!!!!	0
you can just hear how heart broken he is by his voice	3
i was weehzing the whole time	0
my mum thought i was watching porn 	3
Is anyone else concerned that he had a knife in his hand?	0
I WANNA WINNN	3
I WANT TO BE THE FAN OF THE WEEK!!!!!!!!!!	3
Omg I was dying 	0
7:06 WHY DID I LAUGH SO HARD KSKSKSDKS	0
Can i be appreciated? Pls	3
I want to be on the wallllll!!!!!	2
He came in with the damn knife ..lol	2
I wanna fricking win that fan or the week !!!!!!	2
I just don't know what to put in the comments	3
Can I please be on the walllove you guys	3
My ears my ears my ears	3
14:59 same	0
"Is he still f*cking in there?!!!!" 	0
*Throws empty water bottle at Karissa* 	3
I want to be	0
He was so emotional!!! My heart!!!	3
I wanna be on the fan of the weeek.	3
Damn i finished watching it and fuck!!!! Poor Nate...Karissa you made him cry! Good job lol. Awe he cares though!	3
Starting to not believe any of theses pranks.	2
This shit faker then Kim Kardashians tits 	0
Lol jp	0
I watch everyyyyyyyyy videooooooooooooo and like every video.	0
this had me rolling i was scared but so excited holy shittttt	0
brooooo	0
how tf can people believe these are real. they do a prank every day and know its coming	2
I feel so bad for Nate but now Karissa is going to get it so much worse. This was SUCH a good prank 	3
I want to winnnnnnn	3
he got the knife  & i just wanna talk	3
Poor Nate lol that be my though with the knife hahaha	3
Y did he get a knife 	0
 I JuST wAnT tO TaLK 	3
I ..... WANT ..... MY ... NAAAAAAAMEMEEEEE WOOOOOOO	0
you should do the pregnant for 24 hours challenge	0
